inhibitory interneuron,GAD1,GAD2,SPTAN1,PVALB,SLC32A1,TCF25,PLP1,MEF2C,GRIN2B,RSRP1,LNPEP,BNC2,NMNAT2,LHX6,KCNIP2,CD47,SCG2,TRIO,FTH1,CTSB,SPTB,PARP1,CSRNP3,TNKS,GSG1L,HMBOX1,THRB,SULF2,ALDOC,KLF12,SIRT2,NCOR2,SPARC,FAM107A,CTSD,PDE10A,TMEM132C,HSBP1,SOX2OT,CLIC4,SOX6,RAPGEFL1,RORA,7630403G23RIK,CNTNAP5A,TCAP,SERINC3,MBP,ADRA1A,SOX5,SIRT3,CTPS,PTPRO,IL15RA,CALB2,MAF,TGFB3,CREB3L2,AFF3,VWC2L,KLRG1,EPB41L4A,NR3C2,EIF5B,SIRT7,AFF1,CD24A,ZEB1,CD9,ZFP385B,CUX2,HEXB,NFKB1,CRHBP,NFIA,SREBF2,SLC17A7,SFMBT2,DEPTOR,ABCA1,HMGCR,SLC30A3,NAMPT,BCL11B,TRPS1,EGFR,CSPG4,BMP4,ZFP804A,IL18,NFIB,OPALIN,APOE,TCF7L1,CDKN1A,TOX2,MYT1L,ZFP827,RSPO3,MITF,C4B,OLIG1,CNTNAP5B,LCORL,FOXJ1,DGKA,CDKN2A,PBX3,CR2,PCDHB16,CRISPLD1,SOX10,PITPNM3,BANP,PLEKHG3,IRF3,ITPR2,HMGB1,NLRP1B,NFKBIA,H2-AB1,IFI44,IFIT3,GDPD4,COL11A1,EMID1,DIO2,MAML3,IL2RA,GRIN2C,BBX,CNR1,E2F3,TNFSF8,DACH1,HIPK2,CHRM3,FOXP3,HTR4,CD3E,CLEC10A,CGNL1,C1QA,OLIG2,CCR2,EOMES,CD14,3222401L13RIK,FCGR1,CYP27A1,CXCL10,DRD1,KLRB1,MRC1,CD209G,IL22,IL33,IL2RG,SDK1,NEAT1,PROX1,PTGES2,PTPRU,RSKR,MXI1,GRIN3A,IGF2BP3,MAN1A,ARID5B,SLC24A3,TIPARP,A530053G22RIK,NXPH2,PARP14,MS4A1,NDST4,5033421B08RIK,ADGRG6,GLIS3,ANO3,TSHZ2,SMOC2,TTYH2,TGFB2,RREB1,GPC5,SERPINF1,FRMD4B,TRABD2B,C3,CSF1R,CRH,JDP2,CRHR2,ASTN2,S100A10,KCTD8,CREB5,ANO2,B2M,ADORA2A,AIF1,ANLN,APLN,AQP4,BGN,TEAD2,ARHGAP6,JAZF1,MEI1,CD74,TRPC6,ATP10B,PAPPA,CPA6,CPNE5,CPNE7,CPNE9,CRISPLD2,ZC3HAV1,CCND2,ADARB2,C1QL1,FBN2,B230323A14RIK,PARP4,KCNIP3,SATB2,SCUBE1,SELPLG,SERPINA3N,SLC17A6,SLC17A8,SLC6A20A,SNCG,SPI1,SST,SULF1,SYT6,TAP1,TBR1,TBX21,TGFB1,TH,TNF,TREM2,TRIM30A,TTR,UACA,VIP,VIPR2,VTN,CASR,GREB1,LRRC9,COL4A3,PLEKHG1,ONECUT2,MYH11,NLRP3,NPR3,NR4A2,NXPH4,OSR1,OTOF,PDCD1,PDGFRA,PRDM1,PTPRC,RORB,RORC,RSPO1,RXFP1,EBF1,IGF1,FMO2,HS3ST3A1,PRR5L,NFE2L2,NPAS3,CLDN34C1,ADAM12,AXL,NR6A1,HS3ST4,IL1B,IL23A,IL2RB,IL4,IL5,IL6,IL7R,IRF7,ITGAE,ITGAM,ITGAX,ITGB2,KCNJ8,KLRK1,LAMA1,LAMP5,LMO1,LSP1,MFGE8,FBLN2,9530026P05RIK,C130026I21RIK,XDH,TNC,HIF3A,ITGA8,ZBTB20,CD38,FLT1,FN1,FOXP2,GATA3,GBP10,GBP6,GFAP,GSDMD,HPSE,IFITM3,IFNA12,IFNA16,IFNA2,IFNG,IGF2,IL10,IL12A,IL13,IL17A,IL17F,NKAIN3,ILDR2,MEIS1,ZFHX3,9330185C12RIK,DPYSL3,C1QC,CTSS,CX3CR1,CXCL9,DRD2,ENPP6,EXPH5,F13A1,FEZF2,FSTL5,PDE8A,PDE3A,HIVEP3,LILRB4A,CCL2,CCN2,CD19,CD1D1,CDKN2B,CHAT,CHODL,CHRNA2,CLDN5,ACTA2,VIM,LYZ2,ABI3,AGBL1,CD300C2,SP100,CTLA4,PRDM16,EPHB1,CAR3,CALB1,,,,,,,,,,,,,,,,,,,,,,,,,,,,,,,,,,,,,,,,,,,,,,,,,,,,,,,,,,,,,,,,,,,,,,,,,,,,,,,,,,,,,,,,,,,,,,,,,,,,,,,,,,,,,,,,,,,,,,,,,,,,,,,,,,,,,,,,,,,,,,,,,,,,,,,,,,,,,,,,,,,,,,,,,,,,,,,,,,,,,,,,,,,,,,,,,,,,,,,,,,,,,,,,,,,,,,,,,,,,,,,,,,,,,,,,,,,,,,,,,,,,,,,,,,,,,,,,,,,,,,,,,,,,,,,,,,,,,,,,,,,,,,,,,,,,,,,,,,,,,,,,,,,,,,,,,,,,,,,,,,,,,,,,,,,,,,,,,,,,,,,,,,,,,,,,,,,,,,,,,,,,,,,,,,,,,,,,,,,,,,,,,,,,,,,,,,,,,,,,,,,,,,,,,,,,,,,,,,,,,,,,,,,,,,,,,,,,,,,,,,,,,,,,,,,,,,,,,,,,,,,,,,,,,,,,,,,,,,,,,,,,,,,,,,,,,,,,,,,,,,,,,,,,,,,,,,,,,,,,,,,,,,,,,,,,,,,,,,,,,,,,,,,,,,,,,,,,,,,,,,,,,,,,,,,,,,,,,,,,,,,,,,,,,,,,,,,,,,,,,,,,,,,,,,,,,,,,,,,,,,,,,,,normal,cortical layer V,inhibitory interneuron GAD1 GAD2 SPTAN1 PVALB SLC32A1 TCF25 PLP1 MEF2C GRIN2B RSRP1 LNPEP BNC2 NMNAT2 LHX6 KCNIP2 CD47 SCG2 TRIO FTH1 CTSB SPTB PARP1 CSRNP3 TNKS GSG1L HMBOX1 THRB SULF2 ALDOC KLF12 SIRT2 NCOR2 SPARC FAM107A CTSD PDE10A TMEM132C HSBP1 SOX2OT CLIC4 SOX6 RAPGEFL1 RORA 7630403G23RIK CNTNAP5A TCAP SERINC3 MBP ADRA1A SOX5 SIRT3 CTPS PTPRO IL15RA CALB2 MAF TGFB3 CREB3L2 AFF3 VWC2L KLRG1 EPB41L4A NR3C2 EIF5B SIRT7 AFF1 CD24A ZEB1 CD9 ZFP385B CUX2 HEXB NFKB1 CRHBP NFIA SREBF2 SLC17A7 SFMBT2 DEPTOR ABCA1 HMGCR SLC30A3 NAMPT BCL11B TRPS1 EGFR CSPG4 BMP4 ZFP804A IL18 NFIB OPALIN APOE TCF7L1 CDKN1A TOX2 MYT1L ZFP827 RSPO3 MITF C4B OLIG1 CNTNAP5B LCORL FOXJ1 DGKA CDKN2A PBX3 CR2 PCDHB16 CRISPLD1 SOX10 PITPNM3 BANP PLEKHG3 IRF3 ITPR2 HMGB1 NLRP1B NFKBIA H2-AB1 IFI44 IFIT3 GDPD4 COL11A1 EMID1 DIO2 MAML3 IL2RA GRIN2C BBX CNR1 E2F3 TNFSF8 DACH1 HIPK2 CHRM3 FOXP3 HTR4 CD3E CLEC10A CGNL1 C1QA OLIG2 CCR2 EOMES CD14 3222401L13RIK FCGR1 CYP27A1 CXCL10 DRD1 KLRB1 MRC1 CD209G IL22 IL33 IL2RG SDK1 NEAT1 PROX1 PTGES2 PTPRU RSKR MXI1 GRIN3A IGF2BP3 MAN1A ARID5B SLC24A3 TIPARP A530053G22RIK NXPH2 PARP14 MS4A1 NDST4 5033421B08RIK ADGRG6 GLIS3 ANO3 TSHZ2 SMOC2 TTYH2 TGFB2 RREB1 GPC5 SERPINF1 FRMD4B TRABD2B C3 CSF1R CRH JDP2 CRHR2 ASTN2 S100A10 KCTD8 CREB5 ANO2 B2M ADORA2A AIF1 ANLN APLN AQP4 BGN TEAD2 ARHGAP6 JAZF1 MEI1 CD74 TRPC6 ATP10B PAPPA CPA6 CPNE5 CPNE7 CPNE9 CRISPLD2 ZC3HAV1 CCND2 ADARB2 C1QL1 FBN2 B230323A14RIK PARP4 KCNIP3 SATB2 SCUBE1 SELPLG SERPINA3N SLC17A6 SLC17A8 SLC6A20A SNCG SPI1 SST SULF1 SYT6 TAP1 TBR1 TBX21 TGFB1 TH TNF TREM2 TRIM30A TTR UACA VIP VIPR2 VTN CASR GREB1 LRRC9 COL4A3 PLEKHG1 ONECUT2 MYH11 NLRP3 NPR3 NR4A2 NXPH4 OSR1 OTOF PDCD1 PDGFRA PRDM1 PTPRC RORB RORC RSPO1 RXFP1 EBF1 IGF1 FMO2 HS3ST3A1 PRR5L NFE2L2 NPAS3 CLDN34C1 ADAM12 AXL NR6A1 HS3ST4 IL1B IL23A IL2RB IL4 IL5 IL6 IL7R IRF7 ITGAE ITGAM ITGAX ITGB2 KCNJ8 KLRK1 LAMA1 LAMP5 LMO1 LSP1 MFGE8 FBLN2 9530026P05RIK C130026I21RIK XDH TNC HIF3A ITGA8 ZBTB20 CD38 FLT1 FN1 FOXP2 GATA3 GBP10 GBP6 GFAP GSDMD HPSE IFITM3 IFNA12 IFNA16 IFNA2 IFNG IGF2 IL10 IL12A IL13 IL17A IL17F NKAIN3 ILDR2 MEIS1 ZFHX3 9330185C12RIK DPYSL3 C1QC CTSS CX3CR1 CXCL9 DRD2 ENPP6 EXPH5 F13A1 FEZF2 FSTL5 PDE8A PDE3A HIVEP3 LILRB4A CCL2 CCN2 CD19 CD1D1 CDKN2B CHAT CHODL CHRNA2 CLDN5 ACTA2 VIM LYZ2 ABI3 AGBL1 CD300C2 SP100 CTLA4 PRDM16 EPHB1 CAR3 CALB1
macrophage,APOE,MRC1,CTSD,C1QC,F13A1,VTN,IGF2,C1QA,CTSB,NEAT1,B2M,RSRP1,GAD1,CSF1R,CLIC4,ITGAM,C4B,SERINC3,CTSS,FAM107A,CD38,SPARC,MFGE8,FTH1,AXL,CD47,LYZ2,SPTAN1,IFITM3,FRMD4B,HMGB1,NCOR2,LILRB4A,EGFR,RREB1,MYH11,TNKS,ALDOC,ABCA1,IL15RA,PTPRO,ACTA2,TRIO,ITGB2,TGFB1,CLEC10A,SYT6,VIM,ZEB1,NFKBIA,PLEKHG3,ADORA2A,UACA,TNF,LNPEP,EPB41L4A,ABI3,PRDM1,NLRP3,TRIM30A,SERPINF1,GFAP,MAF,IRF7,PARP1,HMBOX1,SOX2OT,PARP4,HSBP1,SLC17A8,PARP14,JDP2,SPI1,CTPS,BGN,CCL2,HIPK2,NFIA,GRIN2B,ZBTB20,TCF25,MAN1A,GBP6,SP100,CGNL1,ZFHX3,CSPG4,FCGR1,MEF2C,AIF1,ILDR2,ADRA1A,NAMPT,KLF12,THRB,ADARB2,ZC3HAV1,3222401L13RIK,PDE3A,DRD1,CRH,GAD2,MYT1L,HEXB,FOXJ1,IFNA16,GSDMD,XDH,IL12A,ZFP385B,ITGA8,IL2RA,TH,EBF1,ANO3,KCNJ8,IL18,PITPNM3,RAPGEFL1,SLC17A6,TAP1,SNCG,TGFB3,TMEM132C,TRABD2B,CREB5,NFKB1,OSR1,MS4A1,NXPH2,PTPRC,CLDN5,CD3E,C3,CDKN2A,C1QL1,NLRP1B,S100A10,OLIG1,PBX3,JAZF1,E2F3,OPALIN,RSPO1,SATB2,RXFP1,PROX1,PTGES2,PLP1,PDCD1,IL23A,SLC30A3,SLC32A1,SLC6A20A,MBP,IL33,ITGAE,IL7R,VIP,TTYH2,VWC2L,LSP1,KLRG1,LAMP5,LAMA1,VIPR2,SLC17A7,TREM2,TCAP,SULF1,SMOC2,IFIT3,HTR4,NPAS3,IGF1,7630403G23RIK,ARID5B,TIPARP,ADGRG6,GLIS3,COL4A3,GREB1,FBLN2,ZFP827,MAML3,CHRM3,NR3C2,CYP27A1,DIO2,CPNE9,AQP4,DPYSL3,RORA,CCND2,SIRT2,CD209G,NFIB,HPSE,CREB3L2,BBX,GBP10,GDPD4,IL13,MITF,PDE8A,EOMES,CSRNP3,ANLN,MEIS1,CCR2,CHAT,OLIG2,TNFSF8,HMGCR,NXPH4,NR4A2,NPR3,NDST4,PAPPA,EIF5B,PDE10A,ATP10B,RSPO3,CD74,MEI1,TRPC6,DACH1,TEAD2,ARHGAP6,KCTD8,CNR1,CHRNA2,CHODL,CD9,EPHB1,CD300C2,CD24A,CD1D1,CDKN2B,CCN2,BCL11B,BNC2,CALB1,CALB2,CAR3,BMP4,5033421B08RIK,PCDHB16,TTR,TSHZ2,LMO1,KLRK1,LHX6,IL1B,IL5,IL4,IL6,IRF3,ITGAX,ITPR2,KCNIP2,KLRB1,IL2RG,IL22,IL2RB,RSKR,RORB,OTOF,PTPRU,PVALB,SOX6,SOX10,SERPINA3N,SST,TBR1,SULF2,TBX21,TGFB2,PDGFRA,RORC,SCUBE1,SELPLG,CD14,CD19,SIRT7,NFE2L2,AFF1,HS3ST3A1,AFF3,HS3ST4,ADAM12,PRR5L,ZFP804A,TOX2,CNTNAP5A,TCF7L1,GRIN3A,CDKN1A,FMO2,BANP,MXI1,GSG1L,SLC24A3,CASR,SFMBT2,PLEKHG1,A530053G22RIK,ONECUT2,LRRC9,SPTB,NMNAT2,SDK1,IL17A,IL17F,IL10,IFNA12,IFNA2,IFNG,H2-AB1,IFI44,FLT1,FN1,FOXP3,FOXP2,GATA3,GRIN2C,IGF2BP3,CLDN34C1,NR6A1,CPA6,CRHBP,COL11A1,SOX5,CPNE5,HIF3A,SREBF2,LCORL,CNTNAP5B,TRPS1,TNC,C130026I21RIK,9530026P05RIK,DRD2,DEPTOR,CXCL10,CXCL9,CX3CR1,CUX2,CRISPLD2,CTLA4,CR2,CPNE7,CRHR2,FEZF2,HIVEP3,FSTL5,ENPP6,EMID1,FBN2,PRDM16,SIRT3,ASTN2,EXPH5,B230323A14RIK,CRISPLD1,GPC5,APLN,NKAIN3,DGKA,KCNIP3,SCG2,ANO2,9330185C12RIK,AGBL1,,,,,,,,,,,,,,,,,,,,,,,,,,,,,,,,,,,,,,,,,,,,,,,,,,,,,,,,,,,,,,,,,,,,,,,,,,,,,,,,,,,,,,,,,,,,,,,,,,,,,,,,,,,,,,,,,,,,,,,,,,,,,,,,,,,,,,,,,,,,,,,,,,,,,,,,,,,,,,,,,,,,,,,,,,,,,,,,,,,,,,,,,,,,,,,,,,,,,,,,,,,,,,,,,,,,,,,,,,,,,,,,,,,,,,,,,,,,,,,,,,,,,,,,,,,,,,,,,,,,,,,,,,,,,,,,,,,,,,,,,,,,,,,,,,,,,,,,,,,,,,,,,,,,,,,,,,,,,,,,,,,,,,,,,,,,,,,,,,,,,,,,,,,,,,,,,,,,,,,,,,,,,,,,,,,,,,,,,,,,,,,,,,,,,,,,,,,,,,,,,,,,,,,,,,,,,,,,,,,,,,,,,,,,,,,,,,,,,,,,,,,,,,,,,,,,,,,,,,,,,,,,,,,,,,,,,,,,,,,,,,,,,,,,,,,,,,,,,,,,,,,,,,,,,,,,,,,,,,,,,,,,,,,,,,,,,,,,,,,,,,,,,,,,,,,,,,,,,,,,,,,,,,,,,,,,,,,,,,,,,,,,,,,,,,,,,,,,,,,,,,,,,,,,,,,,,,,,,,,,,,,,,,,normal,striatum,macrophage APOE MRC1 CTSD C1QC F13A1 VTN IGF2 C1QA CTSB NEAT1 B2M RSRP1 GAD1 CSF1R CLIC4 ITGAM C4B SERINC3 CTSS FAM107A CD38 SPARC MFGE8 FTH1 AXL CD47 LYZ2 SPTAN1 IFITM3 FRMD4B HMGB1 NCOR2 LILRB4A EGFR RREB1 MYH11 TNKS ALDOC ABCA1 IL15RA PTPRO ACTA2 TRIO ITGB2 TGFB1 CLEC10A SYT6 VIM ZEB1 NFKBIA PLEKHG3 ADORA2A UACA TNF LNPEP EPB41L4A ABI3 PRDM1 NLRP3 TRIM30A SERPINF1 GFAP MAF IRF7 PARP1 HMBOX1 SOX2OT PARP4 HSBP1 SLC17A8 PARP14 JDP2 SPI1 CTPS BGN CCL2 HIPK2 NFIA GRIN2B ZBTB20 TCF25 MAN1A GBP6 SP100 CGNL1 ZFHX3 CSPG4 FCGR1 MEF2C AIF1 ILDR2 ADRA1A NAMPT KLF12 THRB ADARB2 ZC3HAV1 3222401L13RIK PDE3A DRD1 CRH GAD2 MYT1L HEXB FOXJ1 IFNA16 GSDMD XDH IL12A ZFP385B ITGA8 IL2RA TH EBF1 ANO3 KCNJ8 IL18 PITPNM3 RAPGEFL1 SLC17A6 TAP1 SNCG TGFB3 TMEM132C TRABD2B CREB5 NFKB1 OSR1 MS4A1 NXPH2 PTPRC CLDN5 CD3E C3 CDKN2A C1QL1 NLRP1B S100A10 OLIG1 PBX3 JAZF1 E2F3 OPALIN RSPO1 SATB2 RXFP1 PROX1 PTGES2 PLP1 PDCD1 IL23A SLC30A3 SLC32A1 SLC6A20A MBP IL33 ITGAE IL7R VIP TTYH2 VWC2L LSP1 KLRG1 LAMP5 LAMA1 VIPR2 SLC17A7 TREM2 TCAP SULF1 SMOC2 IFIT3 HTR4 NPAS3 IGF1 7630403G23RIK ARID5B TIPARP ADGRG6 GLIS3 COL4A3 GREB1 FBLN2 ZFP827 MAML3 CHRM3 NR3C2 CYP27A1 DIO2 CPNE9 AQP4 DPYSL3 RORA CCND2 SIRT2 CD209G NFIB HPSE CREB3L2 BBX GBP10 GDPD4 IL13 MITF PDE8A EOMES CSRNP3 ANLN MEIS1 CCR2 CHAT OLIG2 TNFSF8 HMGCR NXPH4 NR4A2 NPR3 NDST4 PAPPA EIF5B PDE10A ATP10B RSPO3 CD74 MEI1 TRPC6 DACH1 TEAD2 ARHGAP6 KCTD8 CNR1 CHRNA2 CHODL CD9 EPHB1 CD300C2 CD24A CD1D1 CDKN2B CCN2 BCL11B BNC2 CALB1 CALB2 CAR3 BMP4 5033421B08RIK PCDHB16 TTR TSHZ2 LMO1 KLRK1 LHX6 IL1B IL5 IL4 IL6 IRF3 ITGAX ITPR2 KCNIP2 KLRB1 IL2RG IL22 IL2RB RSKR RORB OTOF PTPRU PVALB SOX6 SOX10 SERPINA3N SST TBR1 SULF2 TBX21 TGFB2 PDGFRA RORC SCUBE1 SELPLG CD14 CD19 SIRT7 NFE2L2 AFF1 HS3ST3A1 AFF3 HS3ST4 ADAM12 PRR5L ZFP804A TOX2 CNTNAP5A TCF7L1 GRIN3A CDKN1A FMO2 BANP MXI1 GSG1L SLC24A3 CASR SFMBT2 PLEKHG1 A530053G22RIK ONECUT2 LRRC9 SPTB NMNAT2 SDK1 IL17A IL17F IL10 IFNA12 IFNA2 IFNG H2-AB1 IFI44 FLT1 FN1 FOXP3 FOXP2 GATA3 GRIN2C IGF2BP3 CLDN34C1 NR6A1 CPA6 CRHBP COL11A1 SOX5 CPNE5 HIF3A SREBF2 LCORL CNTNAP5B TRPS1 TNC C130026I21RIK 9530026P05RIK DRD2 DEPTOR CXCL10 CXCL9 CX3CR1 CUX2 CRISPLD2 CTLA4 CR2 CPNE7 CRHR2 FEZF2 HIVEP3 FSTL5 ENPP6 EMID1 FBN2 PRDM16 SIRT3 ASTN2 EXPH5 B230323A14RIK CRISPLD1 GPC5 APLN NKAIN3 DGKA KCNIP3 SCG2 ANO2 9330185C12RIK AGBL1
medium spiny neuron,GAD1,GAD2,MYT1L,DRD1,FOXP2,CD47,BCL11B,NEAT1,SOX2OT,APOE,SPTAN1,SLC32A1,RSRP1,FAM107A,GRIN2B,TCF25,SCG2,VWC2L,DEPTOR,PDE10A,NFIB,HMGB1,TRIO,ALDOC,CSRNP3,LNPEP,CTSB,ZBTB20,TNKS,SYT6,MFGE8,ILDR2,NMNAT2,CTSD,PTPRU,ZEB1,KCNIP2,MEF2C,FTH1,PBX3,CPNE7,OTOF,TRPS1,PTPRO,MBP,SULF1,SPTB,RAPGEFL1,NR3C2,CUX2,CPNE5,BNC2,TCF7L1,PITPNM3,PLP1,CNTNAP5A,KLF12,NCOR2,RREB1,LAMP5,KCNIP3,HSBP1,SIRT3,SPARC,B2M,NFKB1,SLC24A3,RORB,SREBF2,TGFB3,MXI1,SIRT2,ZFP827,ABCA1,ZFP385B,GFAP,CDKN1A,NFKBIA,EPHB1,SULF2,ADARB2,EPB41L4A,SERINC3,HMBOX1,HIF3A,AQP4,CTPS,CALB2,ARHGAP6,MAN1A,JDP2,GRIN3A,ANO3,EIF5B,PARP1,EMID1,AXL,GBP6,CRHBP,CHRM3,CSPG4,CCND2,ADORA2A,ANLN,RORA,PARP4,ZFHX3,THRB,ASTN2,DIO2,AFF3,NPAS3,TGFB2,LRRC9,PCDHB16,ARID5B,TIPARP,KLRG1,AFF1,HS3ST3A1,BBX,RXFP1,TBR1,PVALB,KCTD8,HIPK2,LYZ2,C4B,CCR2,CCN2,CD3E,CHAT,CNR1,CHRNA2,OLIG1,RSPO3,E2F3,HMGCR,TNFSF8,CD9,PAPPA,NLRP3,TRABD2B,SLC17A7,SLC30A3,SPI1,SERPINA3N,RORC,PRDM1,OPALIN,VTN,TNF,TTYH2,TSHZ2,GSG1L,IL23A,SFMBT2,XDH,CTSS,EGFR,CRHR2,CRISPLD2,APLN,MITF,IL15RA,IL12A,IGF2BP3,CLDN34C1,HS3ST4,GATA3,GSDMD,GRIN2C,IFI44,HEXB,KLRK1,LSP1,BANP,ITGAE,IRF7,IL33,IL2RG,IL2RA,CD209G,MAML3,9530026P05RIK,FBLN2,ITGA8,SOX5,LCORL,MEIS1,ACTA2,DGKA,ADRA1A,GPC5,FRMD4B,AIF1,NAMPT,FEZF2,AGBL1,DPYSL3,ANO2,RSKR,SCUBE1,SATB2,RSPO1,CREB5,CD74,S100A10,ATP10B,TRPC6,TEAD2,JAZF1,MEI1,OSR1,NXPH2,NR4A2,NPR3,NLRP1B,MYH11,NDST4,MS4A1,CHODL,CALB1,CAR3,CLEC10A,DACH1,OLIG2,VIM,CLIC4,CLDN5,SP100,CGNL1,CDKN2B,CDKN2A,CD24A,CD300C2,CD19,CD1D1,C3,C1QL1,C1QC,C1QA,CCL2,CD14,BGN,BMP4,IL22,IL1B,IL18,A530053G22RIK,PLEKHG1,ONECUT2,COL4A3,7630403G23RIK,GREB1,ADGRG6,NFIA,GLIS3,CASR,VIP,VIPR2,5033421B08RIK,TGFB1,TCAP,TMEM132C,UACA,TTR,TH,TREM2,TRIM30A,SLC6A20A,SMOC2,SOX10,SNCG,SOX6,SST,TAP1,TBX21,NXPH4,PDGFRA,PDCD1,PARP14,PTPRC,PTGES2,PROX1,PLEKHG3,SELPLG,SLC17A8,SERPINF1,SLC17A6,TOX2,FMO2,SIRT7,ZFP804A,MAF,PRR5L,KCNJ8,ITPR2,LHX6,LMO1,ITGB2,LAMA1,IL7R,IL6,IRF3,ITGAM,ITGAX,IL5,IL4,IL2RB,IL13,IL10,IFNG,IGF2,IFNA2,IFNA16,IFITM3,IFNA12,H2-AB1,HPSE,IFIT3,HTR4,FOXP3,FOXJ1,GDPD4,GBP10,NFE2L2,CREB3L2,NR6A1,FLT1,FN1,ADAM12,MRC1,KLRB1,EBF1,IGF1,CD38,COL11A1,C130026I21RIK,IL17A,IL17F,SDK1,ENPP6,DRD2,CYP27A1,CXCL9,CX3CR1,CXCL10,CSF1R,CTLA4,CPNE9,CPA6,CR2,CRH,CNTNAP5B,TNC,FCGR1,EOMES,FBN2,PRDM16,3222401L13RIK,ZC3HAV1,LILRB4A,HIVEP3,PDE8A,PDE3A,EXPH5,F13A1,FSTL5,B230323A14RIK,NKAIN3,CRISPLD1,ABI3,9330185C12RIK,,,,,,,,,,,,,,,,,,,,,,,,,,,,,,,,,,,,,,,,,,,,,,,,,,,,,,,,,,,,,,,,,,,,,,,,,,,,,,,,,,,,,,,,,,,,,,,,,,,,,,,,,,,,,,,,,,,,,,,,,,,,,,,,,,,,,,,,,,,,,,,,,,,,,,,,,,,,,,,,,,,,,,,,,,,,,,,,,,,,,,,,,,,,,,,,,,,,,,,,,,,,,,,,,,,,,,,,,,,,,,,,,,,,,,,,,,,,,,,,,,,,,,,,,,,,,,,,,,,,,,,,,,,,,,,,,,,,,,,,,,,,,,,,,,,,,,,,,,,,,,,,,,,,,,,,,,,,,,,,,,,,,,,,,,,,,,,,,,,,,,,,,,,,,,,,,,,,,,,,,,,,,,,,,,,,,,,,,,,,,,,,,,,,,,,,,,,,,,,,,,,,,,,,,,,,,,,,,,,,,,,,,,,,,,,,,,,,,,,,,,,,,,,,,,,,,,,,,,,,,,,,,,,,,,,,,,,,,,,,,,,,,,,,,,,,,,,,,,,,,,,,,,,,,,,,,,,,,,,,,,,,,,,,,,,,,,,,,,,,,,,,,,,,,,,,,,,,,,,,,,,,,,,,,,,,,,,,,,,,,,,,,,,,,,,,,,,,,,,,,,,,,,,,,,,,,,,,,,,,,,,,,,,normal,striatum,medium spiny neuron GAD1 GAD2 MYT1L DRD1 FOXP2 CD47 BCL11B NEAT1 SOX2OT APOE SPTAN1 SLC32A1 RSRP1 FAM107A GRIN2B TCF25 SCG2 VWC2L DEPTOR PDE10A NFIB HMGB1 TRIO ALDOC CSRNP3 LNPEP CTSB ZBTB20 TNKS SYT6 MFGE8 ILDR2 NMNAT2 CTSD PTPRU ZEB1 KCNIP2 MEF2C FTH1 PBX3 CPNE7 OTOF TRPS1 PTPRO MBP SULF1 SPTB RAPGEFL1 NR3C2 CUX2 CPNE5 BNC2 TCF7L1 PITPNM3 PLP1 CNTNAP5A KLF12 NCOR2 RREB1 LAMP5 KCNIP3 HSBP1 SIRT3 SPARC B2M NFKB1 SLC24A3 RORB SREBF2 TGFB3 MXI1 SIRT2 ZFP827 ABCA1 ZFP385B GFAP CDKN1A NFKBIA EPHB1 SULF2 ADARB2 EPB41L4A SERINC3 HMBOX1 HIF3A AQP4 CTPS CALB2 ARHGAP6 MAN1A JDP2 GRIN3A ANO3 EIF5B PARP1 EMID1 AXL GBP6 CRHBP CHRM3 CSPG4 CCND2 ADORA2A ANLN RORA PARP4 ZFHX3 THRB ASTN2 DIO2 AFF3 NPAS3 TGFB2 LRRC9 PCDHB16 ARID5B TIPARP KLRG1 AFF1 HS3ST3A1 BBX RXFP1 TBR1 PVALB KCTD8 HIPK2 LYZ2 C4B CCR2 CCN2 CD3E CHAT CNR1 CHRNA2 OLIG1 RSPO3 E2F3 HMGCR TNFSF8 CD9 PAPPA NLRP3 TRABD2B SLC17A7 SLC30A3 SPI1 SERPINA3N RORC PRDM1 OPALIN VTN TNF TTYH2 TSHZ2 GSG1L IL23A SFMBT2 XDH CTSS EGFR CRHR2 CRISPLD2 APLN MITF IL15RA IL12A IGF2BP3 CLDN34C1 HS3ST4 GATA3 GSDMD GRIN2C IFI44 HEXB KLRK1 LSP1 BANP ITGAE IRF7 IL33 IL2RG IL2RA CD209G MAML3 9530026P05RIK FBLN2 ITGA8 SOX5 LCORL MEIS1 ACTA2 DGKA ADRA1A GPC5 FRMD4B AIF1 NAMPT FEZF2 AGBL1 DPYSL3 ANO2 RSKR SCUBE1 SATB2 RSPO1 CREB5 CD74 S100A10 ATP10B TRPC6 TEAD2 JAZF1 MEI1 OSR1 NXPH2 NR4A2 NPR3 NLRP1B MYH11 NDST4 MS4A1 CHODL CALB1 CAR3 CLEC10A DACH1 OLIG2 VIM CLIC4 CLDN5 SP100 CGNL1 CDKN2B CDKN2A CD24A CD300C2 CD19 CD1D1 C3 C1QL1 C1QC C1QA CCL2 CD14 BGN BMP4 IL22 IL1B IL18 A530053G22RIK PLEKHG1 ONECUT2 COL4A3 7630403G23RIK GREB1 ADGRG6 NFIA GLIS3 CASR VIP VIPR2 5033421B08RIK TGFB1 TCAP TMEM132C UACA TTR TH TREM2 TRIM30A SLC6A20A SMOC2 SOX10 SNCG SOX6 SST TAP1 TBX21 NXPH4 PDGFRA PDCD1 PARP14 PTPRC PTGES2 PROX1 PLEKHG3 SELPLG SLC17A8 SERPINF1 SLC17A6 TOX2 FMO2 SIRT7 ZFP804A MAF PRR5L KCNJ8 ITPR2 LHX6 LMO1 ITGB2 LAMA1 IL7R IL6 IRF3 ITGAM ITGAX IL5 IL4 IL2RB IL13 IL10 IFNG IGF2 IFNA2 IFNA16 IFITM3 IFNA12 H2-AB1 HPSE IFIT3 HTR4 FOXP3 FOXJ1 GDPD4 GBP10 NFE2L2 CREB3L2 NR6A1 FLT1 FN1 ADAM12 MRC1 KLRB1 EBF1 IGF1 CD38 COL11A1 C130026I21RIK IL17A IL17F SDK1 ENPP6 DRD2 CYP27A1 CXCL9 CX3CR1 CXCL10 CSF1R CTLA4 CPNE9 CPA6 CR2 CRH CNTNAP5B TNC FCGR1 EOMES FBN2 PRDM16 3222401L13RIK ZC3HAV1 LILRB4A HIVEP3 PDE8A PDE3A EXPH5 F13A1 FSTL5 B230323A14RIK NKAIN3 CRISPLD1 ABI3 9330185C12RIK
microglial cell,PLP1,FTH1,FAM107A,GFAP,CTSS,ANLN,NEAT1,RSRP1,CTSD,SOX2OT,APOE,SPARC,VIM,ALDOC,SIRT2,GAD1,SERPINA3N,C4B,NFIB,SPTAN1,TTYH2,HEXB,BNC2,TNKS,GAD2,CDKN1A,TCF25,ZEB1,C1QA,C1QC,TRIM30A,CX3CR1,CSF1R,PBX3,SULF2,HIPK2,SERINC3,CTSB,CD24A,EPB41L4A,NFIA,ZBTB20,ABI3,BBX,B2M,CD47,SYT6,NFKBIA,CLIC4,DPYSL3,CCND2,MEF2C,PROX1,HIF3A,ILDR2,NMNAT2,FN1,ITGB2,PTPRC,RREB1,BCL11B,HSBP1,RORC,NFKB1,SOX10,PARP14,PDE10A,HMGCR,KCNIP3,ADARB2,IRF3,FBLN2,HMGB1,AFF1,CUX2,MXI1,SELPLG,ARID5B,LNPEP,NAMPT,SP100,PTPRU,NLRP1B,MAF,TRIO,TIPARP,ITGAM,FCGR1,CSPG4,CTPS,IL15RA,PRR5L,SREBF2,KLF12,PARP4,SPI1,PCDHB16,SOX6,TREM2,APLN,MEIS1,NKAIN3,CALB1,CSRNP3,TAP1,HMBOX1,CCR2,PLEKHG1,MYT1L,CNTNAP5A,CREB3L2,IL33,IL2RG,TCF7L1,CNR1,ZC3HAV1,FBN2,COL11A1,EPHB1,TNFSF8,FRMD4B,SLC32A1,ABCA1,MAN1A,IFI44,NCOR2,EIF5B,CRH,NR3C2,ITPR2,TOX2,IL17A,CCL2,C1QL1,CALB2,ACTA2,AGBL1,SCG2,ZFHX3,CYP27A1,IL23A,IL2RB,IL22,KLRG1,IRF7,IL18,MBP,NFE2L2,MAML3,CD209G,ZFP827,IGF2BP3,AXL,CXCL10,CRHBP,IGF2,IFNG,CHRNA2,PTPRO,CPNE5,EGFR,DRD1,HPSE,GSDMD,GBP10,IFNA16,IFIT3,C130026I21RIK,FEZF2,XDH,TNC,FMO2,SULF1,TNF,TGFB2,MYH11,PDCD1,OTOF,TTR,GREB1,GRIN2B,ADGRG6,7630403G23RIK,ANO3,LRRC9,RORB,NXPH2,TBR1,SIRT3,ENPP6,LILRB4A,TBX21,RORA,THRB,ITGA8,OLIG1,JAZF1,ARHGAP6,E2F3,GPC5,CD9,OLIG2,CD300C2,CD14,CD19,CD1D1,CD3E,CDKN2A,CDKN2B,CGNL1,CHAT,CRISPLD1,LYZ2,DACH1,TEAD2,KCTD8,MEI1,CD74,RSPO3,TRPC6,JDP2,SOX5,PARP1,CD38,FSTL5,PDE8A,PDE3A,HIVEP3,3222401L13RIK,ASTN2,MITF,PRDM16,B230323A14RIK,ATP10B,S100A10,CREB5,PAPPA,SLC17A6,SLC17A7,SLC17A8,SLC30A3,SLC6A20A,SMOC2,SNCG,SST,TCAP,TGFB1,TGFB3,TH,TMEM132C,TRABD2B,TSHZ2,UACA,VIP,VIPR2,VTN,VWC2L,MS4A1,NDST4,NLRP3,NPR3,NR4A2,NXPH4,OPALIN,OSR1,PDGFRA,PITPNM3,PLEKHG3,PRDM1,PTGES2,PVALB,RAPGEFL1,RSKR,RSPO1,RXFP1,SATB2,SCUBE1,SERPINF1,5033421B08RIK,CASR,SPTB,GLIS3,SFMBT2,COL4A3,ONECUT2,A530053G22RIK,SLC24A3,GSG1L,EBF1,IGF1,BANP,HS3ST3A1,ZFP804A,SIRT7,IL17F,IL1B,IL2RA,IL4,IL5,IL6,IL7R,ITGAE,ITGAX,KCNIP2,KCNJ8,KLRB1,KLRK1,LAMA1,LAMP5,LHX6,LMO1,LSP1,MFGE8,MRC1,GRIN3A,NPAS3,CLDN34C1,ADAM12,NR6A1,HS3ST4,AFF3,SDK1,9530026P05RIK,ZFP385B,LCORL,CHRM3,EOMES,EXPH5,F13A1,FLT1,FOXJ1,FOXP2,FOXP3,GATA3,GBP6,GDPD4,GRIN2C,H2-AB1,HTR4,IFITM3,IFNA12,IFNA2,IL10,IL12A,IL13,CNTNAP5B,TRPS1,CHODL,CLDN5,CLEC10A,CPA6,CPNE7,CPNE9,CR2,CRHR2,CRISPLD2,CTLA4,CXCL9,DEPTOR,DIO2,DRD2,EMID1,DGKA,ADRA1A,CCN2,AIF1,CAR3,C3,BMP4,BGN,9330185C12RIK,ADORA2A,AQP4,ANO2,,,,,,,,,,,,,,,,,,,,,,,,,,,,,,,,,,,,,,,,,,,,,,,,,,,,,,,,,,,,,,,,,,,,,,,,,,,,,,,,,,,,,,,,,,,,,,,,,,,,,,,,,,,,,,,,,,,,,,,,,,,,,,,,,,,,,,,,,,,,,,,,,,,,,,,,,,,,,,,,,,,,,,,,,,,,,,,,,,,,,,,,,,,,,,,,,,,,,,,,,,,,,,,,,,,,,,,,,,,,,,,,,,,,,,,,,,,,,,,,,,,,,,,,,,,,,,,,,,,,,,,,,,,,,,,,,,,,,,,,,,,,,,,,,,,,,,,,,,,,,,,,,,,,,,,,,,,,,,,,,,,,,,,,,,,,,,,,,,,,,,,,,,,,,,,,,,,,,,,,,,,,,,,,,,,,,,,,,,,,,,,,,,,,,,,,,,,,,,,,,,,,,,,,,,,,,,,,,,,,,,,,,,,,,,,,,,,,,,,,,,,,,,,,,,,,,,,,,,,,,,,,,,,,,,,,,,,,,,,,,,,,,,,,,,,,,,,,,,,,,,,,,,,,,,,,,,,,,,,,,,,,,,,,,,,,,,,,,,,,,,,,,,,,,,,,,,,,,,,,,,,,,,,,,,,,,,,,,,,,,,,,,,,,,,,,,,,,,,,,,,,,,,,,,,,,,,,,,,,,,,,,,,,normal,corpus callosum,microglial cell PLP1 FTH1 FAM107A GFAP CTSS ANLN NEAT1 RSRP1 CTSD SOX2OT APOE SPARC VIM ALDOC SIRT2 GAD1 SERPINA3N C4B NFIB SPTAN1 TTYH2 HEXB BNC2 TNKS GAD2 CDKN1A TCF25 ZEB1 C1QA C1QC TRIM30A CX3CR1 CSF1R PBX3 SULF2 HIPK2 SERINC3 CTSB CD24A EPB41L4A NFIA ZBTB20 ABI3 BBX B2M CD47 SYT6 NFKBIA CLIC4 DPYSL3 CCND2 MEF2C PROX1 HIF3A ILDR2 NMNAT2 FN1 ITGB2 PTPRC RREB1 BCL11B HSBP1 RORC NFKB1 SOX10 PARP14 PDE10A HMGCR KCNIP3 ADARB2 IRF3 FBLN2 HMGB1 AFF1 CUX2 MXI1 SELPLG ARID5B LNPEP NAMPT SP100 PTPRU NLRP1B MAF TRIO TIPARP ITGAM FCGR1 CSPG4 CTPS IL15RA PRR5L SREBF2 KLF12 PARP4 SPI1 PCDHB16 SOX6 TREM2 APLN MEIS1 NKAIN3 CALB1 CSRNP3 TAP1 HMBOX1 CCR2 PLEKHG1 MYT1L CNTNAP5A CREB3L2 IL33 IL2RG TCF7L1 CNR1 ZC3HAV1 FBN2 COL11A1 EPHB1 TNFSF8 FRMD4B SLC32A1 ABCA1 MAN1A IFI44 NCOR2 EIF5B CRH NR3C2 ITPR2 TOX2 IL17A CCL2 C1QL1 CALB2 ACTA2 AGBL1 SCG2 ZFHX3 CYP27A1 IL23A IL2RB IL22 KLRG1 IRF7 IL18 MBP NFE2L2 MAML3 CD209G ZFP827 IGF2BP3 AXL CXCL10 CRHBP IGF2 IFNG CHRNA2 PTPRO CPNE5 EGFR DRD1 HPSE GSDMD GBP10 IFNA16 IFIT3 C130026I21RIK FEZF2 XDH TNC FMO2 SULF1 TNF TGFB2 MYH11 PDCD1 OTOF TTR GREB1 GRIN2B ADGRG6 7630403G23RIK ANO3 LRRC9 RORB NXPH2 TBR1 SIRT3 ENPP6 LILRB4A TBX21 RORA THRB ITGA8 OLIG1 JAZF1 ARHGAP6 E2F3 GPC5 CD9 OLIG2 CD300C2 CD14 CD19 CD1D1 CD3E CDKN2A CDKN2B CGNL1 CHAT CRISPLD1 LYZ2 DACH1 TEAD2 KCTD8 MEI1 CD74 RSPO3 TRPC6 JDP2 SOX5 PARP1 CD38 FSTL5 PDE8A PDE3A HIVEP3 3222401L13RIK ASTN2 MITF PRDM16 B230323A14RIK ATP10B S100A10 CREB5 PAPPA SLC17A6 SLC17A7 SLC17A8 SLC30A3 SLC6A20A SMOC2 SNCG SST TCAP TGFB1 TGFB3 TH TMEM132C TRABD2B TSHZ2 UACA VIP VIPR2 VTN VWC2L MS4A1 NDST4 NLRP3 NPR3 NR4A2 NXPH4 OPALIN OSR1 PDGFRA PITPNM3 PLEKHG3 PRDM1 PTGES2 PVALB RAPGEFL1 RSKR RSPO1 RXFP1 SATB2 SCUBE1 SERPINF1 5033421B08RIK CASR SPTB GLIS3 SFMBT2 COL4A3 ONECUT2 A530053G22RIK SLC24A3 GSG1L EBF1 IGF1 BANP HS3ST3A1 ZFP804A SIRT7 IL17F IL1B IL2RA IL4 IL5 IL6 IL7R ITGAE ITGAX KCNIP2 KCNJ8 KLRB1 KLRK1 LAMA1 LAMP5 LHX6 LMO1 LSP1 MFGE8 MRC1 GRIN3A NPAS3 CLDN34C1 ADAM12 NR6A1 HS3ST4 AFF3 SDK1 9530026P05RIK ZFP385B LCORL CHRM3 EOMES EXPH5 F13A1 FLT1 FOXJ1 FOXP2 FOXP3 GATA3 GBP6 GDPD4 GRIN2C H2-AB1 HTR4 IFITM3 IFNA12 IFNA2 IL10 IL12A IL13 CNTNAP5B TRPS1 CHODL CLDN5 CLEC10A CPA6 CPNE7 CPNE9 CR2 CRHR2 CRISPLD2 CTLA4 CXCL9 DEPTOR DIO2 DRD2 EMID1 DGKA ADRA1A CCN2 AIF1 CAR3 C3 BMP4 BGN 9330185C12RIK ADORA2A AQP4 ANO2
