cell_type,gene_1,gene_2,gene_3,gene_4,gene_5,gene_6,gene_7,gene_8,gene_9,gene_10,gene_11,gene_12,gene_13,gene_14,gene_15,gene_16,gene_17,gene_18,gene_19,gene_20,gene_21,gene_22,gene_23,gene_24,gene_25,gene_26,gene_27,gene_28,gene_29,gene_30,gene_31,gene_32,gene_33,gene_34,gene_35,gene_36,gene_37,gene_38,gene_39,gene_40,gene_41,gene_42,gene_43,gene_44,gene_45,gene_46,gene_47,gene_48,gene_49,gene_50,gene_51,gene_52,gene_53,gene_54,gene_55,gene_56,gene_57,gene_58,gene_59,gene_60,gene_61,gene_62,gene_63,gene_64,gene_65,gene_66,gene_67,gene_68,gene_69,gene_70,gene_71,gene_72,gene_73,gene_74,gene_75,gene_76,gene_77,gene_78,gene_79,gene_80,gene_81,gene_82,gene_83,gene_84,gene_85,gene_86,gene_87,gene_88,gene_89,gene_90,gene_91,gene_92,gene_93,gene_94,gene_95,gene_96,gene_97,gene_98,gene_99,gene_100,gene_101,gene_102,gene_103,gene_104,gene_105,gene_106,gene_107,gene_108,gene_109,gene_110,gene_111,gene_112,gene_113,gene_114,gene_115,gene_116,gene_117,gene_118,gene_119,gene_120,gene_121,gene_122,gene_123,gene_124,gene_125,gene_126,gene_127,gene_128,gene_129,gene_130,gene_131,gene_132,gene_133,gene_134,gene_135,gene_136,gene_137,gene_138,gene_139,gene_140,gene_141,gene_142,gene_143,gene_144,gene_145,gene_146,gene_147,gene_148,gene_149,gene_150,gene_151,gene_152,gene_153,gene_154,gene_155,gene_156,gene_157,gene_158,gene_159,gene_160,gene_161,gene_162,gene_163,gene_164,gene_165,gene_166,gene_167,gene_168,gene_169,gene_170,gene_171,gene_172,gene_173,gene_174,gene_175,gene_176,gene_177,gene_178,gene_179,gene_180,gene_181,gene_182,gene_183,gene_184,gene_185,gene_186,gene_187,gene_188,gene_189,gene_190,gene_191,gene_192,gene_193,gene_194,gene_195,gene_196,gene_197,gene_198,gene_199,gene_200,gene_201,gene_202,gene_203,gene_204,gene_205,gene_206,gene_207,gene_208,gene_209,gene_210,gene_211,gene_212,gene_213,gene_214,gene_215,gene_216,gene_217,gene_218,gene_219,gene_220,gene_221,gene_222,gene_223,gene_224,gene_225,gene_226,gene_227,gene_228,gene_229,gene_230,gene_231,gene_232,gene_233,gene_234,gene_235,gene_236,gene_237,gene_238,gene_239,gene_240,gene_241,gene_242,gene_243,gene_244,gene_245,gene_246,gene_247,gene_248,gene_249,gene_250,gene_251,gene_252,gene_253,gene_254,gene_255,gene_256,gene_257,gene_258,gene_259,gene_260,gene_261,gene_262,gene_263,gene_264,gene_265,gene_266,gene_267,gene_268,gene_269,gene_270,gene_271,gene_272,gene_273,gene_274,gene_275,gene_276,gene_277,gene_278,gene_279,gene_280,gene_281,gene_282,gene_283,gene_284,gene_285,gene_286,gene_287,gene_288,gene_289,gene_290,gene_291,gene_292,gene_293,gene_294,gene_295,gene_296,gene_297,gene_298,gene_299,gene_300,gene_301,gene_302,gene_303,gene_304,gene_305,gene_306,gene_307,gene_308,gene_309,gene_310,gene_311,gene_312,gene_313,gene_314,gene_315,gene_316,gene_317,gene_318,gene_319,gene_320,gene_321,gene_322,gene_323,gene_324,gene_325,gene_326,gene_327,gene_328,gene_329,gene_330,gene_331,gene_332,gene_333,gene_334,gene_335,gene_336,gene_337,gene_338,gene_339,gene_340,gene_341,gene_342,gene_343,gene_344,gene_345,gene_346,gene_347,gene_348,gene_349,gene_350,gene_351,gene_352,gene_353,gene_354,gene_355,gene_356,gene_357,gene_358,gene_359,gene_360,gene_361,gene_362,gene_363,gene_364,gene_365,gene_366,gene_367,gene_368,gene_369,gene_370,gene_371,gene_372,gene_373,gene_374,gene_375,gene_376,gene_377,gene_378,gene_379,gene_380,gene_381,gene_382,gene_383,gene_384,gene_385,gene_386,gene_387,gene_388,gene_389,gene_390,gene_391,gene_392,gene_393,gene_394,gene_395,gene_396,gene_397,gene_398,gene_399,gene_400,gene_401,gene_402,gene_403,gene_404,gene_405,gene_406,gene_407,gene_408,gene_409,gene_410,gene_411,gene_412,gene_413,gene_414,gene_415,gene_416,gene_417,gene_418,gene_419,gene_420,gene_421,gene_422,gene_423,gene_424,gene_425,gene_426,gene_427,gene_428,gene_429,gene_430,gene_431,gene_432,gene_433,gene_434,gene_435,gene_436,gene_437,gene_438,gene_439,gene_440,gene_441,gene_442,gene_443,gene_444,gene_445,gene_446,gene_447,gene_448,gene_449,gene_450,gene_451,gene_452,gene_453,gene_454,gene_455,gene_456,gene_457,gene_458,gene_459,gene_460,gene_461,gene_462,gene_463,gene_464,gene_465,gene_466,gene_467,gene_468,gene_469,gene_470,gene_471,gene_472,gene_473,gene_474,gene_475,gene_476,gene_477,gene_478,gene_479,gene_480,gene_481,gene_482,gene_483,gene_484,gene_485,gene_486,gene_487,gene_488,gene_489,gene_490,gene_491,gene_492,gene_493,gene_494,gene_495,gene_496,gene_497,gene_498,gene_499,gene_500,gene_501,gene_502,gene_503,gene_504,gene_505,gene_506,gene_507,gene_508,gene_509,gene_510,gene_511,gene_512,gene_513,gene_514,gene_515,gene_516,gene_517,gene_518,gene_519,gene_520,gene_521,gene_522,gene_523,gene_524,gene_525,gene_526,gene_527,gene_528,gene_529,gene_530,gene_531,gene_532,gene_533,gene_534,gene_535,gene_536,gene_537,gene_538,gene_539,gene_540,gene_541,gene_542,gene_543,gene_544,gene_545,gene_546,gene_547,gene_548,gene_549,gene_550,gene_551,gene_552,gene_553,gene_554,gene_555,gene_556,gene_557,gene_558,gene_559,gene_560,gene_561,gene_562,gene_563,gene_564,gene_565,gene_566,gene_567,gene_568,gene_569,gene_570,gene_571,gene_572,gene_573,gene_574,gene_575,gene_576,gene_577,gene_578,gene_579,gene_580,gene_581,gene_582,gene_583,gene_584,gene_585,gene_586,gene_587,gene_588,gene_589,gene_590,gene_591,gene_592,gene_593,gene_594,gene_595,gene_596,gene_597,gene_598,gene_599,gene_600,gene_601,gene_602,gene_603,gene_604,gene_605,gene_606,gene_607,gene_608,gene_609,gene_610,gene_611,gene_612,gene_613,gene_614,gene_615,gene_616,gene_617,gene_618,gene_619,gene_620,gene_621,gene_622,gene_623,gene_624,gene_625,gene_626,gene_627,gene_628,gene_629,gene_630,gene_631,gene_632,gene_633,gene_634,gene_635,gene_636,gene_637,gene_638,gene_639,gene_640,gene_641,gene_642,gene_643,gene_644,gene_645,gene_646,gene_647,gene_648,gene_649,gene_650,gene_651,gene_652,gene_653,gene_654,gene_655,gene_656,gene_657,gene_658,gene_659,gene_660,gene_661,gene_662,gene_663,gene_664,gene_665,gene_666,gene_667,gene_668,gene_669,gene_670,gene_671,gene_672,gene_673,gene_674,gene_675,gene_676,gene_677,gene_678,gene_679,gene_680,gene_681,gene_682,gene_683,gene_684,gene_685,gene_686,gene_687,gene_688,gene_689,gene_690,gene_691,gene_692,gene_693,gene_694,gene_695,gene_696,gene_697,gene_698,gene_699,gene_700,gene_701,gene_702,gene_703,gene_704,gene_705,gene_706,gene_707,gene_708,gene_709,gene_710,gene_711,gene_712,gene_713,gene_714,gene_715,gene_716,gene_717,gene_718,gene_719,gene_720,gene_721,gene_722,gene_723,gene_724,gene_725,gene_726,gene_727,gene_728,gene_729,gene_730,gene_731,gene_732,gene_733,gene_734,gene_735,gene_736,gene_737,gene_738,gene_739,gene_740,gene_741,gene_742,gene_743,gene_744,gene_745,gene_746,gene_747,gene_748,gene_749,gene_750,gene_751,gene_752,gene_753,gene_754,gene_755,gene_756,gene_757,gene_758,gene_759,gene_760,gene_761,gene_762,gene_763,gene_764,gene_765,gene_766,gene_767,gene_768,gene_769,gene_770,gene_771,gene_772,gene_773,gene_774,gene_775,gene_776,gene_777,gene_778,gene_779,gene_780,gene_781,gene_782,gene_783,gene_784,gene_785,gene_786,gene_787,gene_788,gene_789,gene_790,gene_791,gene_792,gene_793,gene_794,gene_795,gene_796,gene_797,gene_798,gene_799,gene_800,gene_801,gene_802,gene_803,gene_804,gene_805,gene_806,gene_807,gene_808,gene_809,gene_810,gene_811,gene_812,gene_813,gene_814,gene_815,gene_816,gene_817,gene_818,gene_819,gene_820,gene_821,gene_822,gene_823,gene_824,gene_825,gene_826,gene_827,gene_828,gene_829,gene_830,gene_831,gene_832,gene_833,gene_834,gene_835,gene_836,gene_837,gene_838,gene_839,gene_840,gene_841,gene_842,gene_843,gene_844,gene_845,gene_846,gene_847,gene_848,gene_849,gene_850,gene_851,gene_852,gene_853,gene_854,gene_855,gene_856,gene_857,gene_858,gene_859,gene_860,gene_861,gene_862,gene_863,gene_864,gene_865,gene_866,gene_867,gene_868,gene_869,gene_870,gene_871,gene_872,gene_873,gene_874,gene_875,gene_876,gene_877,gene_878,gene_879,gene_880,gene_881,gene_882,gene_883,gene_884,gene_885,gene_886,gene_887,gene_888,gene_889,gene_890,gene_891,gene_892,gene_893,gene_894,gene_895,gene_896,gene_897,gene_898,gene_899,gene_900,gene_901,gene_902,gene_903,gene_904,gene_905,gene_906,gene_907,gene_908,gene_909,gene_910,gene_911,gene_912,gene_913,gene_914,gene_915,gene_916,gene_917,gene_918,gene_919,gene_920,gene_921,gene_922,gene_923,gene_924,gene_925,gene_926,gene_927,gene_928,gene_929,gene_930,gene_931,gene_932,gene_933,gene_934,gene_935,gene_936,gene_937,gene_938,gene_939,gene_940,gene_941,gene_942,gene_943,gene_944,gene_945,gene_946,gene_947,gene_948,gene_949,gene_950,gene_951,gene_952,gene_953,gene_954,gene_955,gene_956,gene_957,gene_958,gene_959,gene_960,gene_961,gene_962,gene_963,gene_964,gene_965,gene_966,gene_967,gene_968,gene_969,gene_970,gene_971,gene_972,gene_973,gene_974,gene_975,gene_976,gene_977,gene_978,gene_979,gene_980,gene_981,gene_982,gene_983,gene_984,gene_985,gene_986,gene_987,gene_988,gene_989,gene_990,gene_991,gene_992,gene_993,gene_994,gene_995,gene_996,gene_997,gene_998,gene_999,gene_1000,diseases,tissue,cell_sentence
astrocyte,ALDOC,FAM107A,APOE,NEAT1,MFGE8,CD47,HIF3A,CDKN1A,EGFR,NFKBIA,RORB,DIO2,AQP4,ABCA1,SPARC,VIM,FTH1,TCF25,GFAP,ITPR2,HMGCR,RREB1,RSRP1,CTSD,SPTAN1,AFF1,LNPEP,SOX2OT,CNR1,HIPK2,NCOR2,SREBF2,IL15RA,GRIN2C,SLC17A7,TRPS1,IL18,ZBTB20,GPC5,NFE2L2,CTSB,KLF12,SOX6,SERINC3,TIPARP,7630403G23RIK,PLP1,HMGB1,IRF3,PLEKHG1,BNC2,E2F3,FRMD4B,CCND2,APLN,BCL11B,PDE8A,AXL,OLIG2,LCORL,SATB2,RORA,ACTA2,TH,TGFB2,CALB2,GREB1,HEXB,HIVEP3,CNTNAP5A,CREB3L2,CRISPLD2,NR3C2,CRHR2,SIRT2,CSPG4,ADORA2A,KCNIP3,ZEB1,PDCD1,NFIB,ITGAE,NPAS3,RAPGEFL1,TOX2,SOX10,SYT6,PARP4,B2M,SPI1,VTN,SERPINA3N,CHRNA2,PTPRO,FSTL5,TTYH2,SULF2,GRIN2B,SLC24A3,IL2RA,ITGAX,KLRG1,NFIA,TNFSF8,OLIG1,PARP1,COL11A1,GBP6,IL13,NAMPT,SIRT3,ASTN2,FOXJ1,CTSS,NKAIN3,CD9,HMBOX1,TBX21,TBR1,ADRA1A,TNKS,CLEC10A,CPNE5,IFITM3,IFIT3,IFI44,IL12A,PRDM16,THRB,DRD2,DEPTOR,CUX2,CTLA4,ABI3,SCG2,ANLN,CSRNP3,IL22,IFNG,IFNA12,FOXP3,CRHBP,CPNE9,ITGA8,EPB41L4A,GAD2,CD38,GATA3,GSDMD,GSG1L,PITPNM3,FMO2,HS3ST3A1,NFKB1,OTOF,PDGFRA,NLRP1B,PTPRC,PTPRU,MYT1L,IL4,IL33,IL2RG,9530026P05RIK,MS4A1,NMNAT2,ZFP827,IL23A,IGF2BP3,RXFP1,RSKR,SELPLG,PTGES2,MAF,GRIN3A,S100A10,SLC30A3,TGFB1,TGFB3,TAP1,TCAP,VIP,ONECUT2,VIPR2,VWC2L,PCDHB16,5033421B08RIK,TRABD2B,TRIM30A,TSHZ2,TTR,GLIS3,EPHB1,PDE10A,ARHGAP6,PAPPA,EIF5B,DACH1,HSBP1,CGNL1,CLIC4,CD14,CCL2,C1QA,C3,C4B,CALB1,C1QC,C1QL1,CAR3,CCN2,CCR2,CD19,CD1D1,CD24A,CD300C2,CD3E,CDKN2A,CDKN2B,CHAT,CHODL,CLDN5,CPA6,CPNE7,PBX3,TEAD2,KCTD8,JAZF1,MEI1,SP100,CD74,RSPO3,TRPC6,JDP2,ATP10B,CREB5,DGKA,BMP4,SERPINF1,SLC17A6,SLC17A8,SLC32A1,SLC6A20A,SMOC2,SNCG,SST,SULF1,TMEM132C,TNF,TREM2,UACA,CASR,LRRC9,SPTB,ANO3,ADGRG6,SFMBT2,COL4A3,A530053G22RIK,ARID5B,MXI1,EBF1,IGF1,NLRP3,NPR3,NR4A2,NXPH2,NXPH4,OPALIN,OSR1,PARP14,PLEKHG3,PRDM1,PROX1,PVALB,RORC,RSPO1,SCUBE1,BANP,ZFP804A,SIRT7,PRR5L,TCF7L1,CLDN34C1,BBX,MAN1A,TRIO,ADAM12,NR6A1,HS3ST4,AFF3,CD209G,SDK1,IL2RB,IL5,IL6,IL7R,IRF7,ITGAM,ITGB2,KCNIP2,KCNJ8,KLRB1,KLRK1,LAMA1,LAMP5,LHX6,LMO1,LSP1,MBP,MRC1,MYH11,NDST4,FBLN2,MAML3,C130026I21RIK,XDH,TNC,ZFP385B,CHRM3,CNTNAP5B,SOX5,FOXP2,GAD1,GBP10,GDPD4,H2-AB1,HPSE,HTR4,IFNA16,IFNA2,IGF2,IL10,IL17A,IL17F,IL1B,CR2,CRH,CSF1R,CTPS,CX3CR1,CXCL10,CXCL9,CYP27A1,DRD1,EMID1,ENPP6,EOMES,EXPH5,F13A1,FCGR1,FEZF2,FLT1,FN1,MEF2C,PDE3A,LILRB4A,3222401L13RIK,ZC3HAV1,MITF,ADARB2,FBN2,B230323A14RIK,CRISPLD1,LYZ2,ILDR2,MEIS1,ZFHX3,BGN,ANO2,9330185C12RIK,AIF1,DPYSL3,AGBL1,,,,,,,,,,,,,,,,,,,,,,,,,,,,,,,,,,,,,,,,,,,,,,,,,,,,,,,,,,,,,,,,,,,,,,,,,,,,,,,,,,,,,,,,,,,,,,,,,,,,,,,,,,,,,,,,,,,,,,,,,,,,,,,,,,,,,,,,,,,,,,,,,,,,,,,,,,,,,,,,,,,,,,,,,,,,,,,,,,,,,,,,,,,,,,,,,,,,,,,,,,,,,,,,,,,,,,,,,,,,,,,,,,,,,,,,,,,,,,,,,,,,,,,,,,,,,,,,,,,,,,,,,,,,,,,,,,,,,,,,,,,,,,,,,,,,,,,,,,,,,,,,,,,,,,,,,,,,,,,,,,,,,,,,,,,,,,,,,,,,,,,,,,,,,,,,,,,,,,,,,,,,,,,,,,,,,,,,,,,,,,,,,,,,,,,,,,,,,,,,,,,,,,,,,,,,,,,,,,,,,,,,,,,,,,,,,,,,,,,,,,,,,,,,,,,,,,,,,,,,,,,,,,,,,,,,,,,,,,,,,,,,,,,,,,,,,,,,,,,,,,,,,,,,,,,,,,,,,,,,,,,,,,,,,,,,,,,,,,,,,,,,,,,,,,,,,,,,,,,,,,,,,,,,,,,,,,,,,,,,,,,,,,,,,,,,,,,,,,,,,,,,,,,,,,,,,,,,,,,,,,,,,,,normal,cortical layer V,astrocyte ALDOC FAM107A APOE NEAT1 MFGE8 CD47 HIF3A CDKN1A EGFR NFKBIA RORB DIO2 AQP4 ABCA1 SPARC VIM FTH1 TCF25 GFAP ITPR2 HMGCR RREB1 RSRP1 CTSD SPTAN1 AFF1 LNPEP SOX2OT CNR1 HIPK2 NCOR2 SREBF2 IL15RA GRIN2C SLC17A7 TRPS1 IL18 ZBTB20 GPC5 NFE2L2 CTSB KLF12 SOX6 SERINC3 TIPARP 7630403G23RIK PLP1 HMGB1 IRF3 PLEKHG1 BNC2 E2F3 FRMD4B CCND2 APLN BCL11B PDE8A AXL OLIG2 LCORL SATB2 RORA ACTA2 TH TGFB2 CALB2 GREB1 HEXB HIVEP3 CNTNAP5A CREB3L2 CRISPLD2 NR3C2 CRHR2 SIRT2 CSPG4 ADORA2A KCNIP3 ZEB1 PDCD1 NFIB ITGAE NPAS3 RAPGEFL1 TOX2 SOX10 SYT6 PARP4 B2M SPI1 VTN SERPINA3N CHRNA2 PTPRO FSTL5 TTYH2 SULF2 GRIN2B SLC24A3 IL2RA ITGAX KLRG1 NFIA TNFSF8 OLIG1 PARP1 COL11A1 GBP6 IL13 NAMPT SIRT3 ASTN2 FOXJ1 CTSS NKAIN3 CD9 HMBOX1 TBX21 TBR1 ADRA1A TNKS CLEC10A CPNE5 IFITM3 IFIT3 IFI44 IL12A PRDM16 THRB DRD2 DEPTOR CUX2 CTLA4 ABI3 SCG2 ANLN CSRNP3 IL22 IFNG IFNA12 FOXP3 CRHBP CPNE9 ITGA8 EPB41L4A GAD2 CD38 GATA3 GSDMD GSG1L PITPNM3 FMO2 HS3ST3A1 NFKB1 OTOF PDGFRA NLRP1B PTPRC PTPRU MYT1L IL4 IL33 IL2RG 9530026P05RIK MS4A1 NMNAT2 ZFP827 IL23A IGF2BP3 RXFP1 RSKR SELPLG PTGES2 MAF GRIN3A S100A10 SLC30A3 TGFB1 TGFB3 TAP1 TCAP VIP ONECUT2 VIPR2 VWC2L PCDHB16 5033421B08RIK TRABD2B TRIM30A TSHZ2 TTR GLIS3 EPHB1 PDE10A ARHGAP6 PAPPA EIF5B DACH1 HSBP1 CGNL1 CLIC4 CD14 CCL2 C1QA C3 C4B CALB1 C1QC C1QL1 CAR3 CCN2 CCR2 CD19 CD1D1 CD24A CD300C2 CD3E CDKN2A CDKN2B CHAT CHODL CLDN5 CPA6 CPNE7 PBX3 TEAD2 KCTD8 JAZF1 MEI1 SP100 CD74 RSPO3 TRPC6 JDP2 ATP10B CREB5 DGKA BMP4 SERPINF1 SLC17A6 SLC17A8 SLC32A1 SLC6A20A SMOC2 SNCG SST SULF1 TMEM132C TNF TREM2 UACA CASR LRRC9 SPTB ANO3 ADGRG6 SFMBT2 COL4A3 A530053G22RIK ARID5B MXI1 EBF1 IGF1 NLRP3 NPR3 NR4A2 NXPH2 NXPH4 OPALIN OSR1 PARP14 PLEKHG3 PRDM1 PROX1 PVALB RORC RSPO1 SCUBE1 BANP ZFP804A SIRT7 PRR5L TCF7L1 CLDN34C1 BBX MAN1A TRIO ADAM12 NR6A1 HS3ST4 AFF3 CD209G SDK1 IL2RB IL5 IL6 IL7R IRF7 ITGAM ITGB2 KCNIP2 KCNJ8 KLRB1 KLRK1 LAMA1 LAMP5 LHX6 LMO1 LSP1 MBP MRC1 MYH11 NDST4 FBLN2 MAML3 C130026I21RIK XDH TNC ZFP385B CHRM3 CNTNAP5B SOX5 FOXP2 GAD1 GBP10 GDPD4 H2-AB1 HPSE HTR4 IFNA16 IFNA2 IGF2 IL10 IL17A IL17F IL1B CR2 CRH CSF1R CTPS CX3CR1 CXCL10 CXCL9 CYP27A1 DRD1 EMID1 ENPP6 EOMES EXPH5 F13A1 FCGR1 FEZF2 FLT1 FN1 MEF2C PDE3A LILRB4A 3222401L13RIK ZC3HAV1 MITF ADARB2 FBN2 B230323A14RIK CRISPLD1 LYZ2 ILDR2 MEIS1 ZFHX3 BGN ANO2 9330185C12RIK AIF1 DPYSL3 AGBL1
astrocyte,PLP1,FTH1,NEAT1,RSRP1,APOE,ANLN,GAD1,SERPINA3N,ALDOC,FAM107A,MBP,OLIG1,CDKN1A,SOX2OT,TTYH2,MFGE8,GAD2,CLIC4,GRIN2B,TCF25,SPTAN1,SREBF2,SIRT2,TGFB2,HIPK2,NFKBIA,HIF3A,SLC32A1,CD47,C4B,RREB1,PDE8A,CTSD,ZEB1,BNC2,PROX1,CNTNAP5A,RORB,NR3C2,GFAP,ABCA1,TRPS1,NFIB,MAN1A,CTSB,NFE2L2,BBX,AFF3,GRIN3A,ARID5B,PTPRO,AQP4,CSRNP3,OLIG2,SPARC,SERINC3,NAMPT,TGFB3,EIF5B,CPNE5,SLC24A3,CPNE7,THRB,ASTN2,PRDM16,IL18,CRISPLD2,PARP1,TIPARP,PITPNM3,AFF1,CNTNAP5B,MEF2C,CRHBP,SCG2,BCL11B,LAMP5,TRIO,HMGB1,KLRG1,HS3ST4,CNR1,SULF2,PRR5L,VWC2L,PCDHB16,KCTD8,CALB1,HMGCR,TRIM30A,IRF3,KCNIP2,CPA6,ATP10B,CREB5,SLC17A8,ANO3,IL33,RAPGEFL1,FOXJ1,GBP6,HEXB,ZBTB20,IL23A,ENPP6,SIRT3,DIO2,FSTL5,HIVEP3,FRMD4B,KCNIP3,B2M,CD38,CRH,HMBOX1,GPC5,PBX3,SOX10,LNPEP,TNKS,ADAM12,ZFP827,NMNAT2,ITGB2,NFIA,SIRT7,PRDM1,OPALIN,NPAS3,ACTA2,ANO2,ABI3,ILDR2,CCND2,ZC3HAV1,ZFHX3,EGFR,CTPS,CX3CR1,DEPTOR,CHRM3,ZFP385B,SOX5,IFIT3,GSDMD,IL13,CRHR2,BMP4,RORA,3222401L13RIK,PDE3A,DRD2,PLEKHG3,PARP14,MXI1,NLRP1B,ITGAM,LMO1,NFKB1,MS4A1,LSP1,NCOR2,OTOF,PTGES2,TOX2,SCUBE1,PVALB,ZFP804A,IL2RA,NR6A1,CREB3L2,MYT1L,7630403G23RIK,COL4A3,HSBP1,SYT6,TCAP,TSHZ2,SOX6,SPI1,SPTB,LRRC9,PLEKHG1,ADGRG6,VIP,GLIS3,TMEM132C,TREM2,ONECUT2,SMOC2,SULF1,EPHB1,NKAIN3,SP100,TRPC6,PDE10A,CD3E,CPNE9,E2F3,CHODL,CD24A,CD14,C1QL1,C1QA,C1QC,C3,CALB2,CAR3,CCL2,CCN2,CCR2,CD19,CD1D1,CD300C2,CDKN2A,CDKN2B,CGNL1,CHAT,CHRNA2,CLDN5,CLEC10A,TNFSF8,DACH1,TEAD2,ARHGAP6,JAZF1,MEI1,CD74,RSPO3,JDP2,S100A10,PAPPA,DGKA,ADRA1A,SERPINF1,SLC17A6,SLC17A7,SLC30A3,SLC6A20A,SNCG,SST,TAP1,TBR1,TBX21,TGFB1,TH,TNF,TRABD2B,TTR,UACA,VIPR2,VTN,5033421B08RIK,CASR,GREB1,SFMBT2,A530053G22RIK,GSG1L,EBF1,IGF1,NLRP3,NPR3,NR4A2,NXPH2,NXPH4,OSR1,PDCD1,PDGFRA,PTPRC,PTPRU,RORC,RSKR,RSPO1,RXFP1,SATB2,SELPLG,FMO2,BANP,HS3ST3A1,MAF,TCF7L1,IGF2BP3,CLDN34C1,AXL,CD209G,SDK1,IL2RB,IL2RG,IL4,IL5,IL6,IL7R,IRF7,ITGAE,ITGAX,ITPR2,KCNJ8,KLRB1,KLRK1,LAMA1,LHX6,MRC1,MYH11,NDST4,FBLN2,9530026P05RIK,MAML3,C130026I21RIK,XDH,TNC,LCORL,ITGA8,COL11A1,EPB41L4A,FOXP3,GATA3,GBP10,GDPD4,GRIN2C,H2-AB1,HPSE,HTR4,IFI44,IFITM3,IFNA12,IFNA16,IFNA2,IFNG,IGF2,IL10,IL12A,IL15RA,IL17A,IL17F,IL1B,IL22,CR2,CSF1R,CSPG4,CTLA4,CTSS,CUX2,CXCL10,CXCL9,CYP27A1,DRD1,EMID1,EOMES,EXPH5,F13A1,FCGR1,FEZF2,FLT1,FN1,FOXP2,LILRB4A,KLF12,MITF,ADARB2,FBN2,B230323A14RIK,PARP4,CRISPLD1,CD9,VIM,LYZ2,MEIS1,BGN,APLN,AIF1,9330185C12RIK,ADORA2A,DPYSL3,AGBL1,,,,,,,,,,,,,,,,,,,,,,,,,,,,,,,,,,,,,,,,,,,,,,,,,,,,,,,,,,,,,,,,,,,,,,,,,,,,,,,,,,,,,,,,,,,,,,,,,,,,,,,,,,,,,,,,,,,,,,,,,,,,,,,,,,,,,,,,,,,,,,,,,,,,,,,,,,,,,,,,,,,,,,,,,,,,,,,,,,,,,,,,,,,,,,,,,,,,,,,,,,,,,,,,,,,,,,,,,,,,,,,,,,,,,,,,,,,,,,,,,,,,,,,,,,,,,,,,,,,,,,,,,,,,,,,,,,,,,,,,,,,,,,,,,,,,,,,,,,,,,,,,,,,,,,,,,,,,,,,,,,,,,,,,,,,,,,,,,,,,,,,,,,,,,,,,,,,,,,,,,,,,,,,,,,,,,,,,,,,,,,,,,,,,,,,,,,,,,,,,,,,,,,,,,,,,,,,,,,,,,,,,,,,,,,,,,,,,,,,,,,,,,,,,,,,,,,,,,,,,,,,,,,,,,,,,,,,,,,,,,,,,,,,,,,,,,,,,,,,,,,,,,,,,,,,,,,,,,,,,,,,,,,,,,,,,,,,,,,,,,,,,,,,,,,,,,,,,,,,,,,,,,,,,,,,,,,,,,,,,,,,,,,,,,,,,,,,,,,,,,,,,,,,,,,,,,,,,,,,,,,,,,,,normal,olfactory region,astrocyte PLP1 FTH1 NEAT1 RSRP1 APOE ANLN GAD1 SERPINA3N ALDOC FAM107A MBP OLIG1 CDKN1A SOX2OT TTYH2 MFGE8 GAD2 CLIC4 GRIN2B TCF25 SPTAN1 SREBF2 SIRT2 TGFB2 HIPK2 NFKBIA HIF3A SLC32A1 CD47 C4B RREB1 PDE8A CTSD ZEB1 BNC2 PROX1 CNTNAP5A RORB NR3C2 GFAP ABCA1 TRPS1 NFIB MAN1A CTSB NFE2L2 BBX AFF3 GRIN3A ARID5B PTPRO AQP4 CSRNP3 OLIG2 SPARC SERINC3 NAMPT TGFB3 EIF5B CPNE5 SLC24A3 CPNE7 THRB ASTN2 PRDM16 IL18 CRISPLD2 PARP1 TIPARP PITPNM3 AFF1 CNTNAP5B MEF2C CRHBP SCG2 BCL11B LAMP5 TRIO HMGB1 KLRG1 HS3ST4 CNR1 SULF2 PRR5L VWC2L PCDHB16 KCTD8 CALB1 HMGCR TRIM30A IRF3 KCNIP2 CPA6 ATP10B CREB5 SLC17A8 ANO3 IL33 RAPGEFL1 FOXJ1 GBP6 HEXB ZBTB20 IL23A ENPP6 SIRT3 DIO2 FSTL5 HIVEP3 FRMD4B KCNIP3 B2M CD38 CRH HMBOX1 GPC5 PBX3 SOX10 LNPEP TNKS ADAM12 ZFP827 NMNAT2 ITGB2 NFIA SIRT7 PRDM1 OPALIN NPAS3 ACTA2 ANO2 ABI3 ILDR2 CCND2 ZC3HAV1 ZFHX3 EGFR CTPS CX3CR1 DEPTOR CHRM3 ZFP385B SOX5 IFIT3 GSDMD IL13 CRHR2 BMP4 RORA 3222401L13RIK PDE3A DRD2 PLEKHG3 PARP14 MXI1 NLRP1B ITGAM LMO1 NFKB1 MS4A1 LSP1 NCOR2 OTOF PTGES2 TOX2 SCUBE1 PVALB ZFP804A IL2RA NR6A1 CREB3L2 MYT1L 7630403G23RIK COL4A3 HSBP1 SYT6 TCAP TSHZ2 SOX6 SPI1 SPTB LRRC9 PLEKHG1 ADGRG6 VIP GLIS3 TMEM132C TREM2 ONECUT2 SMOC2 SULF1 EPHB1 NKAIN3 SP100 TRPC6 PDE10A CD3E CPNE9 E2F3 CHODL CD24A CD14 C1QL1 C1QA C1QC C3 CALB2 CAR3 CCL2 CCN2 CCR2 CD19 CD1D1 CD300C2 CDKN2A CDKN2B CGNL1 CHAT CHRNA2 CLDN5 CLEC10A TNFSF8 DACH1 TEAD2 ARHGAP6 JAZF1 MEI1 CD74 RSPO3 JDP2 S100A10 PAPPA DGKA ADRA1A SERPINF1 SLC17A6 SLC17A7 SLC30A3 SLC6A20A SNCG SST TAP1 TBR1 TBX21 TGFB1 TH TNF TRABD2B TTR UACA VIPR2 VTN 5033421B08RIK CASR GREB1 SFMBT2 A530053G22RIK GSG1L EBF1 IGF1 NLRP3 NPR3 NR4A2 NXPH2 NXPH4 OSR1 PDCD1 PDGFRA PTPRC PTPRU RORC RSKR RSPO1 RXFP1 SATB2 SELPLG FMO2 BANP HS3ST3A1 MAF TCF7L1 IGF2BP3 CLDN34C1 AXL CD209G SDK1 IL2RB IL2RG IL4 IL5 IL6 IL7R IRF7 ITGAE ITGAX ITPR2 KCNJ8 KLRB1 KLRK1 LAMA1 LHX6 MRC1 MYH11 NDST4 FBLN2 9530026P05RIK MAML3 C130026I21RIK XDH TNC LCORL ITGA8 COL11A1 EPB41L4A FOXP3 GATA3 GBP10 GDPD4 GRIN2C H2-AB1 HPSE HTR4 IFI44 IFITM3 IFNA12 IFNA16 IFNA2 IFNG IGF2 IL10 IL12A IL15RA IL17A IL17F IL1B IL22 CR2 CSF1R CSPG4 CTLA4 CTSS CUX2 CXCL10 CXCL9 CYP27A1 DRD1 EMID1 EOMES EXPH5 F13A1 FCGR1 FEZF2 FLT1 FN1 FOXP2 LILRB4A KLF12 MITF ADARB2 FBN2 B230323A14RIK PARP4 CRISPLD1 CD9 VIM LYZ2 MEIS1 BGN APLN AIF1 9330185C12RIK ADORA2A DPYSL3 AGBL1
astrocyte,GFAP,GAD1,APOE,FAM107A,ALDOC,SERPINA3N,GAD2,NEAT1,RSRP1,CNR1,AQP4,C4B,VIM,SOX2OT,SREBF2,NFIB,TCF25,CPNE7,SULF2,B2M,SPARC,SPTAN1,NFIA,RREB1,NFKBIA,SLC32A1,CD47,RORB,LNPEP,FTH1,PROX1,ADRA1A,EGFR,GRIN2B,TRPS1,ADARB2,IL18,LAMP5,THRB,ZBTB20,CTSD,TGFB2,BNC2,ASTN2,SERINC3,RXFP1,HIPK2,MFGE8,GRIN3A,TNKS,HSBP1,GREB1,MEF2C,NMNAT2,CNTNAP5A,NPAS3,RAPGEFL1,JDP2,MYT1L,IFITM3,FOXJ1,PTPRO,HMGB1,DEPTOR,ILDR2,EMID1,JAZF1,BCL11B,IGF2,PCDHB16,SIRT3,NCOR2,TOX2,PRR5L,VWC2L,IL2RA,IGF1,IRF3,PITPNM3,BGN,E2F3,KCNIP3,TRIO,NR3C2,HIF3A,KLF12,DGKA,HMBOX1,CCND2,NAMPT,CTSB,TNC,KLRG1,KCNIP2,HEXB,CSRNP3,SCG2,CSF1R,NR6A1,TCF7L1,IFIT3,BBX,LCORL,SOX5,CTPS,CPA6,CSPG4,NKAIN3,PARP4,PDE8A,HS3ST3A1,SIRT7,CDKN1A,SLC24A3,SLC17A7,TBR1,SYT6,SOX6,TGFB3,TRABD2B,TSHZ2,TTYH2,HMGCR,RSPO1,SERPINF1,RORC,C1QL1,CD3E,CCN2,CALB2,C3,C1QC,CDKN2B,CD14,PDE10A,DACH1,OLIG1,ARHGAP6,NFKB1,EIF5B,MYH11,MS4A1,LYZ2,CD9,CRISPLD1,CLEC10A,OTOF,PARP14,PDCD1,NXPH2,TH,TMEM132C,UACA,TRIM30A,CASR,5033421B08RIK,TCAP,SST,SULF1,TAP1,PLEKHG1,GLIS3,ANO3,TIPARP,VTN,VIP,PLP1,PVALB,IL10,FBLN2,IL12A,IL15RA,IFI44,NFE2L2,MXI1,AFF1,GSG1L,BANP,MAF,KLRB1,ITPR2,IL4,9530026P05RIK,CHRM3,CPNE5,CR2,CTSS,CUX2,CRHR2,CRH,ENPP6,EOMES,MITF,RORA,3222401L13RIK,HIVEP3,EPB41L4A,FSTL5,AXL,GBP6,AIF1,ANLN,ZEB1,ABI3,ACTA2,ZFHX3,GPC5,SIRT2,PBX3,EPHB1,CCR2,CD19,PTPRC,PTGES2,NR4A2,NPR3,NLRP3,NLRP1B,NDST4,S100A10,CREB5,MRC1,RSPO3,TRPC6,ATP10B,TEAD2,KCTD8,MEI1,SP100,CD74,OLIG2,TNFSF8,CLDN5,CHRNA2,CGNL1,CDKN2A,CD300C2,CD24A,CAR3,CD1D1,CHODL,CHAT,BMP4,C1QA,CCL2,CALB1,IL2RG,IL2RB,IL23A,IL22,IL1B,IL17F,IL17A,A530053G22RIK,ADGRG6,ONECUT2,7630403G23RIK,COL4A3,SFMBT2,VIPR2,LRRC9,SPTB,TNF,TGFB1,TREM2,TTR,SATB2,SCUBE1,SELPLG,SLC17A6,SMOC2,SLC6A20A,SLC30A3,SLC17A8,SPI1,SOX10,SNCG,TBX21,OPALIN,OSR1,NXPH4,PDGFRA,PLEKHG3,PRDM1,PTPRU,RSKR,MAN1A,CLDN34C1,IGF2BP3,ZFP804A,FMO2,MBP,LSP1,ADAM12,LHX6,LAMA1,KLRK1,KCNJ8,ITGAX,ITGB2,ARID5B,LMO1,EBF1,ITGAE,ITGAM,IL33,IL7R,IRF7,IL5,IL6,SDK1,CD209G,AFF3,HS3ST4,IL13,IFNA16,IFNA2,IFNG,HPSE,HTR4,IFNA12,GBP10,GDPD4,GRIN2C,GSDMD,H2-AB1,FCGR1,FN1,FLT1,FEZF2,CREB3L2,GATA3,FOXP3,FOXP2,CPNE9,CLIC4,ABCA1,ZFP385B,C130026I21RIK,XDH,MAML3,ZFP827,DRD1,DRD2,CYP27A1,DIO2,CXCL9,CXCL10,CTLA4,CX3CR1,CRHBP,CRISPLD2,CNTNAP5B,ITGA8,PARP1,COL11A1,LILRB4A,EXPH5,FRMD4B,FBN2,PRDM16,ZC3HAV1,CD38,F13A1,PDE3A,B230323A14RIK,ADORA2A,ANO2,PAPPA,APLN,MEIS1,9330185C12RIK,DPYSL3,AGBL1,,,,,,,,,,,,,,,,,,,,,,,,,,,,,,,,,,,,,,,,,,,,,,,,,,,,,,,,,,,,,,,,,,,,,,,,,,,,,,,,,,,,,,,,,,,,,,,,,,,,,,,,,,,,,,,,,,,,,,,,,,,,,,,,,,,,,,,,,,,,,,,,,,,,,,,,,,,,,,,,,,,,,,,,,,,,,,,,,,,,,,,,,,,,,,,,,,,,,,,,,,,,,,,,,,,,,,,,,,,,,,,,,,,,,,,,,,,,,,,,,,,,,,,,,,,,,,,,,,,,,,,,,,,,,,,,,,,,,,,,,,,,,,,,,,,,,,,,,,,,,,,,,,,,,,,,,,,,,,,,,,,,,,,,,,,,,,,,,,,,,,,,,,,,,,,,,,,,,,,,,,,,,,,,,,,,,,,,,,,,,,,,,,,,,,,,,,,,,,,,,,,,,,,,,,,,,,,,,,,,,,,,,,,,,,,,,,,,,,,,,,,,,,,,,,,,,,,,,,,,,,,,,,,,,,,,,,,,,,,,,,,,,,,,,,,,,,,,,,,,,,,,,,,,,,,,,,,,,,,,,,,,,,,,,,,,,,,,,,,,,,,,,,,,,,,,,,,,,,,,,,,,,,,,,,,,,,,,,,,,,,,,,,,,,,,,,,,,,,,,,,,,,,,,,,,,,,,,,,,,,,,,,,,normal,pia mater,astrocyte GFAP GAD1 APOE FAM107A ALDOC SERPINA3N GAD2 NEAT1 RSRP1 CNR1 AQP4 C4B VIM SOX2OT SREBF2 NFIB TCF25 CPNE7 SULF2 B2M SPARC SPTAN1 NFIA RREB1 NFKBIA SLC32A1 CD47 RORB LNPEP FTH1 PROX1 ADRA1A EGFR GRIN2B TRPS1 ADARB2 IL18 LAMP5 THRB ZBTB20 CTSD TGFB2 BNC2 ASTN2 SERINC3 RXFP1 HIPK2 MFGE8 GRIN3A TNKS HSBP1 GREB1 MEF2C NMNAT2 CNTNAP5A NPAS3 RAPGEFL1 JDP2 MYT1L IFITM3 FOXJ1 PTPRO HMGB1 DEPTOR ILDR2 EMID1 JAZF1 BCL11B IGF2 PCDHB16 SIRT3 NCOR2 TOX2 PRR5L VWC2L IL2RA IGF1 IRF3 PITPNM3 BGN E2F3 KCNIP3 TRIO NR3C2 HIF3A KLF12 DGKA HMBOX1 CCND2 NAMPT CTSB TNC KLRG1 KCNIP2 HEXB CSRNP3 SCG2 CSF1R NR6A1 TCF7L1 IFIT3 BBX LCORL SOX5 CTPS CPA6 CSPG4 NKAIN3 PARP4 PDE8A HS3ST3A1 SIRT7 CDKN1A SLC24A3 SLC17A7 TBR1 SYT6 SOX6 TGFB3 TRABD2B TSHZ2 TTYH2 HMGCR RSPO1 SERPINF1 RORC C1QL1 CD3E CCN2 CALB2 C3 C1QC CDKN2B CD14 PDE10A DACH1 OLIG1 ARHGAP6 NFKB1 EIF5B MYH11 MS4A1 LYZ2 CD9 CRISPLD1 CLEC10A OTOF PARP14 PDCD1 NXPH2 TH TMEM132C UACA TRIM30A CASR 5033421B08RIK TCAP SST SULF1 TAP1 PLEKHG1 GLIS3 ANO3 TIPARP VTN VIP PLP1 PVALB IL10 FBLN2 IL12A IL15RA IFI44 NFE2L2 MXI1 AFF1 GSG1L BANP MAF KLRB1 ITPR2 IL4 9530026P05RIK CHRM3 CPNE5 CR2 CTSS CUX2 CRHR2 CRH ENPP6 EOMES MITF RORA 3222401L13RIK HIVEP3 EPB41L4A FSTL5 AXL GBP6 AIF1 ANLN ZEB1 ABI3 ACTA2 ZFHX3 GPC5 SIRT2 PBX3 EPHB1 CCR2 CD19 PTPRC PTGES2 NR4A2 NPR3 NLRP3 NLRP1B NDST4 S100A10 CREB5 MRC1 RSPO3 TRPC6 ATP10B TEAD2 KCTD8 MEI1 SP100 CD74 OLIG2 TNFSF8 CLDN5 CHRNA2 CGNL1 CDKN2A CD300C2 CD24A CAR3 CD1D1 CHODL CHAT BMP4 C1QA CCL2 CALB1 IL2RG IL2RB IL23A IL22 IL1B IL17F IL17A A530053G22RIK ADGRG6 ONECUT2 7630403G23RIK COL4A3 SFMBT2 VIPR2 LRRC9 SPTB TNF TGFB1 TREM2 TTR SATB2 SCUBE1 SELPLG SLC17A6 SMOC2 SLC6A20A SLC30A3 SLC17A8 SPI1 SOX10 SNCG TBX21 OPALIN OSR1 NXPH4 PDGFRA PLEKHG3 PRDM1 PTPRU RSKR MAN1A CLDN34C1 IGF2BP3 ZFP804A FMO2 MBP LSP1 ADAM12 LHX6 LAMA1 KLRK1 KCNJ8 ITGAX ITGB2 ARID5B LMO1 EBF1 ITGAE ITGAM IL33 IL7R IRF7 IL5 IL6 SDK1 CD209G AFF3 HS3ST4 IL13 IFNA16 IFNA2 IFNG HPSE HTR4 IFNA12 GBP10 GDPD4 GRIN2C GSDMD H2-AB1 FCGR1 FN1 FLT1 FEZF2 CREB3L2 GATA3 FOXP3 FOXP2 CPNE9 CLIC4 ABCA1 ZFP385B C130026I21RIK XDH MAML3 ZFP827 DRD1 DRD2 CYP27A1 DIO2 CXCL9 CXCL10 CTLA4 CX3CR1 CRHBP CRISPLD2 CNTNAP5B ITGA8 PARP1 COL11A1 LILRB4A EXPH5 FRMD4B FBN2 PRDM16 ZC3HAV1 CD38 F13A1 PDE3A B230323A14RIK ADORA2A ANO2 PAPPA APLN MEIS1 9330185C12RIK DPYSL3 AGBL1
