oligodendrocyte,PLP1,GAD2,GAD1,NEAT1,CALB2,SOX2OT,RSRP1,FTH1,SPTAN1,CNR1,CDKN1A,SLC32A1,TCF25,CD47,C4B,NCOR2,LHX6,NFIB,HIPK2,ZEB1,TNKS,APOE,NFKBIA,HMGB1,SULF2,MBP,LNPEP,ONECUT2,RREB1,CSRNP3,SCG2,SIRT2,ANLN,SERINC3,RORA,NMNAT2,SLC17A6,TGFB3,NFIA,BNC2,OPALIN,NDST4,IL33,HMBOX1,SPARC,ABCA1,ADRA1A,MYT1L,HSBP1,7630403G23RIK,FAM107A,GBP6,ZBTB20,NR3C2,KLF12,DPYSL3,OLIG1,FBLN2,ZFP827,SOX10,CUX2,MEF2C,PDE10A,C1QL1,THRB,FRMD4B,BCL11B,CTPS,PARP4,FSTL5,GFAP,ALDOC,MAF,PROX1,PTPRU,MAML3,LAMP5,KLRG1,TRPS1,ARID5B,SREBF2,NKAIN3,CPNE5,TTYH2,PLEKHG1,GRIN2B,CLIC4,OLIG2,HMGCR,CD24A,EPHB1,DGKA,JAZF1,JDP2,SERPINA3N,TAP1,NLRP1B,KCNIP2,SLC24A3,MXI1,CSPG4,IL18,EPB41L4A,CD38,FOXJ1,ASTN2,B2M,MITF,DRD2,NAMPT,EGFR,IFI44,CHRM3,CTSD,RSPO1,TOX2,TRIM30A,TRABD2B,S100A10,ITPR2,CREB3L2,BBX,IL2RA,CRISPLD1,CPNE9,KCNIP3,MEIS1,AQP4,CD9,EOMES,ADORA2A,9330185C12RIK,HIVEP3,ZC3HAV1,SIRT3,FOXP2,PDE8A,GBP10,GDPD4,FOXP3,GATA3,SOX5,CRH,CXCL9,IL22,CRISPLD2,IFNA16,IFIT3,GRIN2C,H2-AB1,HEXB,SIRT7,CNTNAP5A,CTSB,ZFP385B,MS4A1,IRF3,ITGAE,AFF3,TRIO,MYH11,ZFP804A,AFF1,PRR5L,RORC,RORB,SCUBE1,RXFP1,GSG1L,TIPARP,NR4A2,PTPRC,RAPGEFL1,PVALB,OSR1,PITPNM3,GREB1,LRRC9,SPTB,ANO3,VTN,TH,PCDHB16,SFMBT2,ATP10B,SERPINF1,SPI1,SULF1,SYT6,VWC2L,BMP4,EIF5B,TNFSF8,KCTD8,TRPC6,CLDN5,CD3E,CPA6,CD19,CCN2,C1QA,C1QC,C3,CALB1,CAR3,CCL2,CCR2,CD14,CD1D1,CD300C2,CDKN2A,CDKN2B,CGNL1,CHAT,CHODL,CHRNA2,CLEC10A,CPNE7,PBX3,E2F3,DACH1,TEAD2,ARHGAP6,MEI1,SP100,CD74,RSPO3,CREB5,PAPPA,SLC17A7,SLC17A8,SLC30A3,SLC6A20A,SMOC2,SNCG,SOX6,SST,TBR1,TBX21,TCAP,TGFB1,TGFB2,TMEM132C,TNF,TREM2,TSHZ2,TTR,UACA,VIP,VIPR2,5033421B08RIK,CASR,ADGRG6,GLIS3,COL4A3,A530053G22RIK,EBF1,IGF1,NFKB1,NLRP3,NPR3,NXPH2,NXPH4,OTOF,PARP14,PDCD1,PDGFRA,PLEKHG3,PRDM1,PTGES2,RSKR,SATB2,SELPLG,FMO2,BANP,HS3ST3A1,NFE2L2,GRIN3A,TCF7L1,NPAS3,IGF2BP3,CLDN34C1,MAN1A,ADAM12,AXL,NR6A1,HS3ST4,CD209G,SDK1,IL23A,IL2RB,IL2RG,IL4,IL5,IL6,IL7R,IRF7,ITGAM,ITGAX,ITGB2,KCNJ8,KLRB1,KLRK1,LAMA1,LMO1,LSP1,MFGE8,MRC1,9530026P05RIK,C130026I21RIK,XDH,TNC,HIF3A,LCORL,CNTNAP5B,PTPRO,ITGA8,COL11A1,PARP1,GSDMD,HPSE,HTR4,IFITM3,IFNA12,IFNA2,IFNG,IGF2,IL10,IL12A,IL13,IL15RA,IL17A,IL17F,IL1B,CR2,CRHBP,CRHR2,CSF1R,CTLA4,CTSS,CX3CR1,CXCL10,CYP27A1,DEPTOR,DIO2,DRD1,EMID1,ENPP6,EXPH5,F13A1,FCGR1,FEZF2,FLT1,FN1,PDE3A,LILRB4A,3222401L13RIK,CCND2,ADARB2,PRDM16,FBN2,B230323A14RIK,GPC5,VIM,LYZ2,ILDR2,BGN,ZFHX3,APLN,ANO2,AIF1,ACTA2,ABI3,AGBL1,,,,,,,,,,,,,,,,,,,,,,,,,,,,,,,,,,,,,,,,,,,,,,,,,,,,,,,,,,,,,,,,,,,,,,,,,,,,,,,,,,,,,,,,,,,,,,,,,,,,,,,,,,,,,,,,,,,,,,,,,,,,,,,,,,,,,,,,,,,,,,,,,,,,,,,,,,,,,,,,,,,,,,,,,,,,,,,,,,,,,,,,,,,,,,,,,,,,,,,,,,,,,,,,,,,,,,,,,,,,,,,,,,,,,,,,,,,,,,,,,,,,,,,,,,,,,,,,,,,,,,,,,,,,,,,,,,,,,,,,,,,,,,,,,,,,,,,,,,,,,,,,,,,,,,,,,,,,,,,,,,,,,,,,,,,,,,,,,,,,,,,,,,,,,,,,,,,,,,,,,,,,,,,,,,,,,,,,,,,,,,,,,,,,,,,,,,,,,,,,,,,,,,,,,,,,,,,,,,,,,,,,,,,,,,,,,,,,,,,,,,,,,,,,,,,,,,,,,,,,,,,,,,,,,,,,,,,,,,,,,,,,,,,,,,,,,,,,,,,,,,,,,,,,,,,,,,,,,,,,,,,,,,,,,,,,,,,,,,,,,,,,,,,,,,,,,,,,,,,,,,,,,,,,,,,,,,,,,,,,,,,,,,,,,,,,,,,,,,,,,,,,,,,,,,,,,,,,,,,,,,,,,,,normal,brain ventricle,oligodendrocyte PLP1 GAD2 GAD1 NEAT1 CALB2 SOX2OT RSRP1 FTH1 SPTAN1 CNR1 CDKN1A SLC32A1 TCF25 CD47 C4B NCOR2 LHX6 NFIB HIPK2 ZEB1 TNKS APOE NFKBIA HMGB1 SULF2 MBP LNPEP ONECUT2 RREB1 CSRNP3 SCG2 SIRT2 ANLN SERINC3 RORA NMNAT2 SLC17A6 TGFB3 NFIA BNC2 OPALIN NDST4 IL33 HMBOX1 SPARC ABCA1 ADRA1A MYT1L HSBP1 7630403G23RIK FAM107A GBP6 ZBTB20 NR3C2 KLF12 DPYSL3 OLIG1 FBLN2 ZFP827 SOX10 CUX2 MEF2C PDE10A C1QL1 THRB FRMD4B BCL11B CTPS PARP4 FSTL5 GFAP ALDOC MAF PROX1 PTPRU MAML3 LAMP5 KLRG1 TRPS1 ARID5B SREBF2 NKAIN3 CPNE5 TTYH2 PLEKHG1 GRIN2B CLIC4 OLIG2 HMGCR CD24A EPHB1 DGKA JAZF1 JDP2 SERPINA3N TAP1 NLRP1B KCNIP2 SLC24A3 MXI1 CSPG4 IL18 EPB41L4A CD38 FOXJ1 ASTN2 B2M MITF DRD2 NAMPT EGFR IFI44 CHRM3 CTSD RSPO1 TOX2 TRIM30A TRABD2B S100A10 ITPR2 CREB3L2 BBX IL2RA CRISPLD1 CPNE9 KCNIP3 MEIS1 AQP4 CD9 EOMES ADORA2A 9330185C12RIK HIVEP3 ZC3HAV1 SIRT3 FOXP2 PDE8A GBP10 GDPD4 FOXP3 GATA3 SOX5 CRH CXCL9 IL22 CRISPLD2 IFNA16 IFIT3 GRIN2C H2-AB1 HEXB SIRT7 CNTNAP5A CTSB ZFP385B MS4A1 IRF3 ITGAE AFF3 TRIO MYH11 ZFP804A AFF1 PRR5L RORC RORB SCUBE1 RXFP1 GSG1L TIPARP NR4A2 PTPRC RAPGEFL1 PVALB OSR1 PITPNM3 GREB1 LRRC9 SPTB ANO3 VTN TH PCDHB16 SFMBT2 ATP10B SERPINF1 SPI1 SULF1 SYT6 VWC2L BMP4 EIF5B TNFSF8 KCTD8 TRPC6 CLDN5 CD3E CPA6 CD19 CCN2 C1QA C1QC C3 CALB1 CAR3 CCL2 CCR2 CD14 CD1D1 CD300C2 CDKN2A CDKN2B CGNL1 CHAT CHODL CHRNA2 CLEC10A CPNE7 PBX3 E2F3 DACH1 TEAD2 ARHGAP6 MEI1 SP100 CD74 RSPO3 CREB5 PAPPA SLC17A7 SLC17A8 SLC30A3 SLC6A20A SMOC2 SNCG SOX6 SST TBR1 TBX21 TCAP TGFB1 TGFB2 TMEM132C TNF TREM2 TSHZ2 TTR UACA VIP VIPR2 5033421B08RIK CASR ADGRG6 GLIS3 COL4A3 A530053G22RIK EBF1 IGF1 NFKB1 NLRP3 NPR3 NXPH2 NXPH4 OTOF PARP14 PDCD1 PDGFRA PLEKHG3 PRDM1 PTGES2 RSKR SATB2 SELPLG FMO2 BANP HS3ST3A1 NFE2L2 GRIN3A TCF7L1 NPAS3 IGF2BP3 CLDN34C1 MAN1A ADAM12 AXL NR6A1 HS3ST4 CD209G SDK1 IL23A IL2RB IL2RG IL4 IL5 IL6 IL7R IRF7 ITGAM ITGAX ITGB2 KCNJ8 KLRB1 KLRK1 LAMA1 LMO1 LSP1 MFGE8 MRC1 9530026P05RIK C130026I21RIK XDH TNC HIF3A LCORL CNTNAP5B PTPRO ITGA8 COL11A1 PARP1 GSDMD HPSE HTR4 IFITM3 IFNA12 IFNA2 IFNG IGF2 IL10 IL12A IL13 IL15RA IL17A IL17F IL1B CR2 CRHBP CRHR2 CSF1R CTLA4 CTSS CX3CR1 CXCL10 CYP27A1 DEPTOR DIO2 DRD1 EMID1 ENPP6 EXPH5 F13A1 FCGR1 FEZF2 FLT1 FN1 PDE3A LILRB4A 3222401L13RIK CCND2 ADARB2 PRDM16 FBN2 B230323A14RIK GPC5 VIM LYZ2 ILDR2 BGN ZFHX3 APLN ANO2 AIF1 ACTA2 ABI3 AGBL1
oligodendrocyte,PLP1,SLC17A7,FTH1,RSRP1,FAM107A,ANLN,ALDOC,MBP,SPTAN1,APOE,TBR1,NFKBIA,NEAT1,CD47,GFAP,CDKN1A,SIRT2,C4B,MYT1L,TTYH2,HIPK2,MEF2C,SOX10,BNC2,NAMPT,TCF25,OLIG1,BCL11B,SYT6,HS3ST4,CLIC4,GRIN2B,NCOR2,SOX2OT,SPARC,RREB1,CTSB,SULF1,HIF3A,CYP27A1,NFIA,BBX,NFIB,KCNIP3,ONECUT2,CNTNAP5A,CHRM3,ABCA1,ZBTB20,MFGE8,GRIN2C,NR3C2,ENPP6,PTPRU,PROX1,SERPINA3N,CTSD,SREBF2,ITGAM,SATB2,SULF2,DIO2,TNKS,FEZF2,APLN,RAPGEFL1,PLEKHG3,GPC5,MITF,CREB5,S100A10,MYH11,KCNIP2,LNPEP,AQP4,HIVEP3,ATP10B,B2M,IL18,HMGB1,LCORL,TGFB3,NPAS3,ARID5B,7630403G23RIK,TRIO,TH,VWC2L,TGFB2,ANO3,ITPR2,SIRT7,CSRNP3,GATA3,CRISPLD2,EPB41L4A,CTPS,SERINC3,ASTN2,JDP2,THRB,RXFP1,PCDHB16,RORB,TAP1,NMNAT2,CDKN2A,IL33,PRR5L,AFF1,GSG1L,NFE2L2,TCF7L1,FRMD4B,HMBOX1,CD9,PLEKHG1,EGFR,KCTD8,GBP10,TRPS1,DPYSL3,SCG2,AIF1,GBP6,CUX2,CPNE9,FOXJ1,FOXP2,PTPRO,CTSS,ZEB1,ACTA2,PDE8A,PARP1,SOX5,ZFP385B,ITGAE,IRF3,LHX6,LAMP5,KLRG1,NFKB1,NXPH2,MS4A1,NLRP1B,TOX2,CREB3L2,CLDN34C1,ZFP804A,FMO2,IGF1,EPHB1,CD209G,TNC,ZFP827,CDKN2B,CNTNAP5B,IL2RA,IL23A,SDK1,IL5,IL4,IFIT3,IL22,IGF2,IL10,HPSE,IFI44,CGNL1,CPA6,DACH1,NKAIN3,PARP14,HSBP1,PDCD1,PITPNM3,SCUBE1,SLC17A6,RSPO1,SOX6,VTN,OTOF,PVALB,RSKR,3222401L13RIK,PRDM16,PDE10A,ILDR2,CD24A,OLIG2,FBN2,VIM,CAR3,CCL2,CCR2,CCN2,CD1D1,C1QA,C1QL1,C3,BGN,BMP4,C1QC,CALB1,CALB2,CD14,CD19,CD300C2,CD3E,B230323A14RIK,PARP4,CRISPLD1,LYZ2,TNFSF8,PDE3A,LILRB4A,SIRT3,KLF12,ZC3HAV1,CCND2,ADARB2,RORA,RSPO3,TRPC6,EIF5B,PAPPA,DGKA,ADRA1A,MEIS1,ZFHX3,PDGFRA,PRDM1,PTGES2,PTPRC,RORC,SELPLG,SERPINF1,SLC17A8,SLC30A3,SLC32A1,SLC6A20A,SMOC2,SNCG,SPI1,SST,TBX21,TCAP,TGFB1,TMEM132C,TNF,TRABD2B,TREM2,TRIM30A,TSHZ2,TTR,UACA,VIP,VIPR2,5033421B08RIK,CASR,GREB1,LRRC9,SPTB,ADGRG6,GLIS3,SFMBT2,IL7R,IRF7,ITGAX,ITGB2,KCNJ8,KLRB1,KLRK1,LAMA1,LMO1,LSP1,MRC1,NDST4,NLRP3,NPR3,NR4A2,NXPH4,OPALIN,OSR1,COL4A3,A530053G22RIK,TIPARP,SLC24A3,MXI1,EBF1,BANP,HS3ST3A1,MAF,GRIN3A,IGF2BP3,MAN1A,GDPD4,GSDMD,H2-AB1,HEXB,HTR4,IFITM3,IFNA12,IFNA16,IFNA2,IFNG,IL12A,IL13,IL15RA,IL17A,IL17F,IL1B,IL2RB,IL2RG,IL6,ADAM12,AXL,NR6A1,AFF3,FBLN2,9530026P05RIK,MAML3,C130026I21RIK,XDH,CHAT,CHODL,CHRNA2,CLDN5,CLEC10A,CNR1,HMGCR,PBX3,E2F3,TEAD2,ARHGAP6,JAZF1,MEI1,SP100,CD74,DRD2,EMID1,EOMES,EXPH5,F13A1,FCGR1,FLT1,FN1,FOXP3,GAD1,GAD2,CPNE5,CPNE7,CR2,CRH,CRHBP,CRHR2,CSF1R,CSPG4,CTLA4,CX3CR1,CXCL10,CXCL9,DEPTOR,DRD1,ITGA8,COL11A1,CD38,FSTL5,ANO2,9330185C12RIK,ADORA2A,ABI3,AGBL1,,,,,,,,,,,,,,,,,,,,,,,,,,,,,,,,,,,,,,,,,,,,,,,,,,,,,,,,,,,,,,,,,,,,,,,,,,,,,,,,,,,,,,,,,,,,,,,,,,,,,,,,,,,,,,,,,,,,,,,,,,,,,,,,,,,,,,,,,,,,,,,,,,,,,,,,,,,,,,,,,,,,,,,,,,,,,,,,,,,,,,,,,,,,,,,,,,,,,,,,,,,,,,,,,,,,,,,,,,,,,,,,,,,,,,,,,,,,,,,,,,,,,,,,,,,,,,,,,,,,,,,,,,,,,,,,,,,,,,,,,,,,,,,,,,,,,,,,,,,,,,,,,,,,,,,,,,,,,,,,,,,,,,,,,,,,,,,,,,,,,,,,,,,,,,,,,,,,,,,,,,,,,,,,,,,,,,,,,,,,,,,,,,,,,,,,,,,,,,,,,,,,,,,,,,,,,,,,,,,,,,,,,,,,,,,,,,,,,,,,,,,,,,,,,,,,,,,,,,,,,,,,,,,,,,,,,,,,,,,,,,,,,,,,,,,,,,,,,,,,,,,,,,,,,,,,,,,,,,,,,,,,,,,,,,,,,,,,,,,,,,,,,,,,,,,,,,,,,,,,,,,,,,,,,,,,,,,,,,,,,,,,,,,,,,,,,,,,,,,,,,,,,,,,,,,,,,,,,,,,,,,,,,,normal,cortical layer VI,oligodendrocyte PLP1 SLC17A7 FTH1 RSRP1 FAM107A ANLN ALDOC MBP SPTAN1 APOE TBR1 NFKBIA NEAT1 CD47 GFAP CDKN1A SIRT2 C4B MYT1L TTYH2 HIPK2 MEF2C SOX10 BNC2 NAMPT TCF25 OLIG1 BCL11B SYT6 HS3ST4 CLIC4 GRIN2B NCOR2 SOX2OT SPARC RREB1 CTSB SULF1 HIF3A CYP27A1 NFIA BBX NFIB KCNIP3 ONECUT2 CNTNAP5A CHRM3 ABCA1 ZBTB20 MFGE8 GRIN2C NR3C2 ENPP6 PTPRU PROX1 SERPINA3N CTSD SREBF2 ITGAM SATB2 SULF2 DIO2 TNKS FEZF2 APLN RAPGEFL1 PLEKHG3 GPC5 MITF CREB5 S100A10 MYH11 KCNIP2 LNPEP AQP4 HIVEP3 ATP10B B2M IL18 HMGB1 LCORL TGFB3 NPAS3 ARID5B 7630403G23RIK TRIO TH VWC2L TGFB2 ANO3 ITPR2 SIRT7 CSRNP3 GATA3 CRISPLD2 EPB41L4A CTPS SERINC3 ASTN2 JDP2 THRB RXFP1 PCDHB16 RORB TAP1 NMNAT2 CDKN2A IL33 PRR5L AFF1 GSG1L NFE2L2 TCF7L1 FRMD4B HMBOX1 CD9 PLEKHG1 EGFR KCTD8 GBP10 TRPS1 DPYSL3 SCG2 AIF1 GBP6 CUX2 CPNE9 FOXJ1 FOXP2 PTPRO CTSS ZEB1 ACTA2 PDE8A PARP1 SOX5 ZFP385B ITGAE IRF3 LHX6 LAMP5 KLRG1 NFKB1 NXPH2 MS4A1 NLRP1B TOX2 CREB3L2 CLDN34C1 ZFP804A FMO2 IGF1 EPHB1 CD209G TNC ZFP827 CDKN2B CNTNAP5B IL2RA IL23A SDK1 IL5 IL4 IFIT3 IL22 IGF2 IL10 HPSE IFI44 CGNL1 CPA6 DACH1 NKAIN3 PARP14 HSBP1 PDCD1 PITPNM3 SCUBE1 SLC17A6 RSPO1 SOX6 VTN OTOF PVALB RSKR 3222401L13RIK PRDM16 PDE10A ILDR2 CD24A OLIG2 FBN2 VIM CAR3 CCL2 CCR2 CCN2 CD1D1 C1QA C1QL1 C3 BGN BMP4 C1QC CALB1 CALB2 CD14 CD19 CD300C2 CD3E B230323A14RIK PARP4 CRISPLD1 LYZ2 TNFSF8 PDE3A LILRB4A SIRT3 KLF12 ZC3HAV1 CCND2 ADARB2 RORA RSPO3 TRPC6 EIF5B PAPPA DGKA ADRA1A MEIS1 ZFHX3 PDGFRA PRDM1 PTGES2 PTPRC RORC SELPLG SERPINF1 SLC17A8 SLC30A3 SLC32A1 SLC6A20A SMOC2 SNCG SPI1 SST TBX21 TCAP TGFB1 TMEM132C TNF TRABD2B TREM2 TRIM30A TSHZ2 TTR UACA VIP VIPR2 5033421B08RIK CASR GREB1 LRRC9 SPTB ADGRG6 GLIS3 SFMBT2 IL7R IRF7 ITGAX ITGB2 KCNJ8 KLRB1 KLRK1 LAMA1 LMO1 LSP1 MRC1 NDST4 NLRP3 NPR3 NR4A2 NXPH4 OPALIN OSR1 COL4A3 A530053G22RIK TIPARP SLC24A3 MXI1 EBF1 BANP HS3ST3A1 MAF GRIN3A IGF2BP3 MAN1A GDPD4 GSDMD H2-AB1 HEXB HTR4 IFITM3 IFNA12 IFNA16 IFNA2 IFNG IL12A IL13 IL15RA IL17A IL17F IL1B IL2RB IL2RG IL6 ADAM12 AXL NR6A1 AFF3 FBLN2 9530026P05RIK MAML3 C130026I21RIK XDH CHAT CHODL CHRNA2 CLDN5 CLEC10A CNR1 HMGCR PBX3 E2F3 TEAD2 ARHGAP6 JAZF1 MEI1 SP100 CD74 DRD2 EMID1 EOMES EXPH5 F13A1 FCGR1 FLT1 FN1 FOXP3 GAD1 GAD2 CPNE5 CPNE7 CR2 CRH CRHBP CRHR2 CSF1R CSPG4 CTLA4 CX3CR1 CXCL10 CXCL9 DEPTOR DRD1 ITGA8 COL11A1 CD38 FSTL5 ANO2 9330185C12RIK ADORA2A ABI3 AGBL1
oligodendrocyte precursor cell,PDGFRA,SLC17A7,SOX10,SPTAN1,SULF2,OLIG1,RSRP1,MEF2C,OLIG2,SOX2OT,CNR1,TCF25,BNC2,NMNAT2,GRIN2B,ALDOC,APOE,GAD1,SERINC3,ITPR2,KCNIP3,CD47,CSPG4,FTH1,PLP1,FAM107A,TRIO,LNPEP,SIRT2,CTSD,PITPNM3,NFIB,HMGB1,SOX6,MYT1L,LAMP5,ZEB1,PTPRO,ADARB2,TNKS,NCOR2,RAPGEFL1,SREBF2,HIPK2,RORA,NFIA,RREB1,CSRNP3,GRIN3A,EMID1,HMBOX1,SPARC,B2M,ZBTB20,TBR1,IL18,HSBP1,ABCA1,CPNE7,MFGE8,HMGCR,GAD2,EPB41L4A,CTSB,HEXB,ASTN2,SLC30A3,PARP1,HIF3A,CPNE9,GSG1L,ADRA1A,CNTNAP5A,TTYH2,CALB1,GPC5,SCG2,C4B,CUX2,ILDR2,SERPINA3N,AQP4,DPYSL3,MBP,IL2RA,RORB,SLC24A3,SATB2,KCNIP2,CDKN1A,PROX1,HIVEP3,CTPS,NFKB1,ZFP827,TIPARP,EXPH5,PDE10A,SOX5,TGFB3,TRPC6,TSHZ2,PCDHB16,NR3C2,EIF5B,AXL,SCUBE1,ARID5B,TRPS1,DGKA,MAF,DIO2,CREB3L2,DEPTOR,KLF12,CYP27A1,BCL11B,ANO3,THRB,CRISPLD1,FSTL5,NR4A2,TOX2,CALB2,C1QL1,NR6A1,MXI1,7630403G23RIK,NKAIN3,SIRT3,CRH,PTGES2,JAZF1,CRHBP,OSR1,SLC32A1,FBLN2,MAML3,SIRT7,AFF1,NAMPT,TRABD2B,SMOC2,E2F3,LMO1,BBX,CX3CR1,VWC2L,AFF3,ONECUT2,VIP,CPNE5,PDCD1,LCORL,TNFSF8,CD3E,CCND2,IRF7,CCL2,ADGRG6,TBX21,PARP4,SPI1,ZFP385B,ARHGAP6,MAN1A,C1QA,CD24A,IL15RA,CNTNAP5B,IL17A,KLRG1,TAP1,ZC3HAV1,MYH11,SPTB,IL2RB,NLRP1B,SDK1,AIF1,PRR5L,APLN,OTOF,PTPRU,CXCL9,NFE2L2,BMP4,SULF1,SELPLG,TMEM132C,IRF3,IL5,CSF1R,HTR4,KLRK1,CD9,SYT6,CREB5,3222401L13RIK,JDP2,DACH1,NLRP3,CD14,ANLN,IFIT3,XDH,EGFR,CTSS,UACA,TCAP,LRRC9,GDPD4,ADORA2A,GRIN2C,IL10,AGBL1,GSDMD,CD19,IL13,DRD2,DRD1,RSPO3,ABI3,NXPH2,IL22,IL33,C3,FEZF2,LSP1,MS4A1,IL2RG,IL23A,ITGAE,LHX6,TH,ITGB2,VTN,S100A10,CLDN5,ADAM12,FOXP3,NEAT1,NPAS3,ITGAM,TCF7L1,EPHB1,FRMD4B,NFKBIA,ZFHX3,ANO2,MRC1,HS3ST4,CDKN2A,CPA6,RSKR,SLC17A6,RSPO1,VIM,COL11A1,IL12A,GFAP,EOMES,SERPINF1,KCTD8,TRIM30A,RORC,PDE3A,CD38,RXFP1,PTPRC,ITGA8,IGF1,CLDN34C1,PRDM1,HS3ST3A1,PAPPA,PBX3,LYZ2,ACTA2,IGF2,GBP10,CRISPLD2,IL17F,COL4A3,NDST4,SFMBT2,CHRM3,GREB1,PARP14,IL4,NXPH4,IFITM3,FLT1,ENPP6,SST,TGFB1,TNF,TEAD2,VIPR2,PLEKHG1,ATP10B,CHRNA2,EBF1,IFNG,PDE8A,TGFB2,CLIC4,CCR2,FOXJ1,MEIS1,IFNA2,LILRB4A,FBN2,H2-AB1,IGF2BP3,IFNA12,TREM2,TTR,5033421B08RIK,CHAT,CDKN2B,CD300C2,CD1D1,CGNL1,CLEC10A,CHODL,CCN2,CAR3,C1QC,SNCG,SLC6A20A,SP100,MEI1,SLC17A8,CD74,NPR3,CASR,A530053G22RIK,OPALIN,FMO2,BANP,ZFP804A,TNC,C130026I21RIK,9530026P05RIK,LAMA1,KLRB1,KCNJ8,IL7R,ITGAX,CD209G,IL6,GLIS3,PLEKHG3,PVALB,FOXP2,GBP6,IFI44,CTLA4,CRHR2,CR2,IL1B,IFNA16,GATA3,HPSE,CXCL10,MITF,FN1,FCGR1,F13A1,BGN,B230323A14RIK,PRDM16,9330185C12RIK,,,,,,,,,,,,,,,,,,,,,,,,,,,,,,,,,,,,,,,,,,,,,,,,,,,,,,,,,,,,,,,,,,,,,,,,,,,,,,,,,,,,,,,,,,,,,,,,,,,,,,,,,,,,,,,,,,,,,,,,,,,,,,,,,,,,,,,,,,,,,,,,,,,,,,,,,,,,,,,,,,,,,,,,,,,,,,,,,,,,,,,,,,,,,,,,,,,,,,,,,,,,,,,,,,,,,,,,,,,,,,,,,,,,,,,,,,,,,,,,,,,,,,,,,,,,,,,,,,,,,,,,,,,,,,,,,,,,,,,,,,,,,,,,,,,,,,,,,,,,,,,,,,,,,,,,,,,,,,,,,,,,,,,,,,,,,,,,,,,,,,,,,,,,,,,,,,,,,,,,,,,,,,,,,,,,,,,,,,,,,,,,,,,,,,,,,,,,,,,,,,,,,,,,,,,,,,,,,,,,,,,,,,,,,,,,,,,,,,,,,,,,,,,,,,,,,,,,,,,,,,,,,,,,,,,,,,,,,,,,,,,,,,,,,,,,,,,,,,,,,,,,,,,,,,,,,,,,,,,,,,,,,,,,,,,,,,,,,,,,,,,,,,,,,,,,,,,,,,,,,,,,,,,,,,,,,,,,,,,,,,,,,,,,,,,,,,,,,,,,,,,,,,,,,,,,,,,,,,,,,,,,,,,normal,cortical layer II/III,oligodendrocyte precursor cell PDGFRA SLC17A7 SOX10 SPTAN1 SULF2 OLIG1 RSRP1 MEF2C OLIG2 SOX2OT CNR1 TCF25 BNC2 NMNAT2 GRIN2B ALDOC APOE GAD1 SERINC3 ITPR2 KCNIP3 CD47 CSPG4 FTH1 PLP1 FAM107A TRIO LNPEP SIRT2 CTSD PITPNM3 NFIB HMGB1 SOX6 MYT1L LAMP5 ZEB1 PTPRO ADARB2 TNKS NCOR2 RAPGEFL1 SREBF2 HIPK2 RORA NFIA RREB1 CSRNP3 GRIN3A EMID1 HMBOX1 SPARC B2M ZBTB20 TBR1 IL18 HSBP1 ABCA1 CPNE7 MFGE8 HMGCR GAD2 EPB41L4A CTSB HEXB ASTN2 SLC30A3 PARP1 HIF3A CPNE9 GSG1L ADRA1A CNTNAP5A TTYH2 CALB1 GPC5 SCG2 C4B CUX2 ILDR2 SERPINA3N AQP4 DPYSL3 MBP IL2RA RORB SLC24A3 SATB2 KCNIP2 CDKN1A PROX1 HIVEP3 CTPS NFKB1 ZFP827 TIPARP EXPH5 PDE10A SOX5 TGFB3 TRPC6 TSHZ2 PCDHB16 NR3C2 EIF5B AXL SCUBE1 ARID5B TRPS1 DGKA MAF DIO2 CREB3L2 DEPTOR KLF12 CYP27A1 BCL11B ANO3 THRB CRISPLD1 FSTL5 NR4A2 TOX2 CALB2 C1QL1 NR6A1 MXI1 7630403G23RIK NKAIN3 SIRT3 CRH PTGES2 JAZF1 CRHBP OSR1 SLC32A1 FBLN2 MAML3 SIRT7 AFF1 NAMPT TRABD2B SMOC2 E2F3 LMO1 BBX CX3CR1 VWC2L AFF3 ONECUT2 VIP CPNE5 PDCD1 LCORL TNFSF8 CD3E CCND2 IRF7 CCL2 ADGRG6 TBX21 PARP4 SPI1 ZFP385B ARHGAP6 MAN1A C1QA CD24A IL15RA CNTNAP5B IL17A KLRG1 TAP1 ZC3HAV1 MYH11 SPTB IL2RB NLRP1B SDK1 AIF1 PRR5L APLN OTOF PTPRU CXCL9 NFE2L2 BMP4 SULF1 SELPLG TMEM132C IRF3 IL5 CSF1R HTR4 KLRK1 CD9 SYT6 CREB5 3222401L13RIK JDP2 DACH1 NLRP3 CD14 ANLN IFIT3 XDH EGFR CTSS UACA TCAP LRRC9 GDPD4 ADORA2A GRIN2C IL10 AGBL1 GSDMD CD19 IL13 DRD2 DRD1 RSPO3 ABI3 NXPH2 IL22 IL33 C3 FEZF2 LSP1 MS4A1 IL2RG IL23A ITGAE LHX6 TH ITGB2 VTN S100A10 CLDN5 ADAM12 FOXP3 NEAT1 NPAS3 ITGAM TCF7L1 EPHB1 FRMD4B NFKBIA ZFHX3 ANO2 MRC1 HS3ST4 CDKN2A CPA6 RSKR SLC17A6 RSPO1 VIM COL11A1 IL12A GFAP EOMES SERPINF1 KCTD8 TRIM30A RORC PDE3A CD38 RXFP1 PTPRC ITGA8 IGF1 CLDN34C1 PRDM1 HS3ST3A1 PAPPA PBX3 LYZ2 ACTA2 IGF2 GBP10 CRISPLD2 IL17F COL4A3 NDST4 SFMBT2 CHRM3 GREB1 PARP14 IL4 NXPH4 IFITM3 FLT1 ENPP6 SST TGFB1 TNF TEAD2 VIPR2 PLEKHG1 ATP10B CHRNA2 EBF1 IFNG PDE8A TGFB2 CLIC4 CCR2 FOXJ1 MEIS1 IFNA2 LILRB4A FBN2 H2-AB1 IGF2BP3 IFNA12 TREM2 TTR 5033421B08RIK CHAT CDKN2B CD300C2 CD1D1 CGNL1 CLEC10A CHODL CCN2 CAR3 C1QC SNCG SLC6A20A SP100 MEI1 SLC17A8 CD74 NPR3 CASR A530053G22RIK OPALIN FMO2 BANP ZFP804A TNC C130026I21RIK 9530026P05RIK LAMA1 KLRB1 KCNJ8 IL7R ITGAX CD209G IL6 GLIS3 PLEKHG3 PVALB FOXP2 GBP6 IFI44 CTLA4 CRHR2 CR2 IL1B IFNA16 GATA3 HPSE CXCL10 MITF FN1 FCGR1 F13A1 BGN B230323A14RIK PRDM16 9330185C12RIK
oligodendrocyte precursor cell,PDGFRA,SOX10,OLIG1,SULF2,OLIG2,SLC17A7,SPTAN1,ALDOC,CSPG4,APOE,C4B,FAM107A,TCF25,ITPR2,TRIO,SIRT2,KCNIP3,PLP1,NMNAT2,SPARC,FTH1,SOX2OT,CTSD,SREBF2,GPC5,TTYH2,CD47,HIPK2,NCOR2,ADARB2,ZEB1,SERINC3,ABCA1,HMBOX1,NFKBIA,RSRP1,BCL11B,ZBTB20,TNKS,MEF2C,IFITM3,SCG2,MYT1L,HMGB1,NFIA,NFIB,PARP1,ADRA1A,BNC2,MBP,SOX5,GRIN2B,RAPGEFL1,TBR1,GAD1,NPAS3,CLIC4,DPYSL3,C1QL1,THRB,FEZF2,CNR1,HMGCR,CD9,EMID1,MFGE8,HIF3A,AQP4,CTSB,SERPINA3N,GRIN3A,SOX6,CDKN1A,DIO2,CPNE7,SIRT7,SCUBE1,LAMP5,B2M,RREB1,NR3C2,IL18,HSBP1,IRF7,SATB2,IFIT3,NPR3,CCL2,CREB3L2,AXL,PTPRU,PDE8A,ASTN2,PTPRO,CXCL10,LNPEP,NFKB1,IL2RG,PTGES2,CTPS,SLC24A3,SPTB,CYP27A1,CUX2,PROX1,IL15RA,CLDN5,C1QA,VWC2L,ZC3HAV1,AFF3,GSG1L,ITGAE,TRIM30A,FSTL5,BMP4,ARID5B,IL2RA,PDE10A,BBX,CALB2,TGFB2,ZFP827,FLT1,PITPNM3,FN1,CCND2,CGNL1,AFF1,OTOF,FBLN2,SLC30A3,TCF7L1,EBF1,JAZF1,PCDHB16,LMO1,HEXB,KCNIP2,CD38,CSRNP3,ZFHX3,KLRG1,EPB41L4A,PDCD1,EIF5B,KLF12,RORA,7630403G23RIK,PARP14,TAP1,CHRM3,HIVEP3,NKAIN3,TEAD2,MXI1,NAMPT,MYH11,HTR4,TGFB3,TNFSF8,E2F3,GBP6,VIM,PVALB,IRF3,CRHBP,FOXP3,TMEM132C,TRABD2B,CALB1,MITF,DRD2,ACTA2,FRMD4B,TSHZ2,CDKN2B,NFE2L2,SULF1,DGKA,PARP4,CTSS,SIRT3,IL6,NR4A2,DACH1,JDP2,EPHB1,ZFP385B,IL33,PTPRC,VIPR2,CDKN2A,C3,SERPINF1,TGFB1,SP100,VTN,PBX3,CAR3,DEPTOR,PDE3A,APLN,XDH,ADORA2A,LHX6,CRH,TRPS1,FBN2,B230323A14RIK,FOXJ1,LYZ2,EGFR,IFI44,GSDMD,HPSE,IL4,IL23A,COL11A1,GRIN2C,IFNA16,CRHR2,IL17A,IL17F,CSF1R,GFAP,IGF2,IFNG,GATA3,PLEKHG3,RORC,TH,TOX2,BANP,HS3ST4,NR6A1,SLC32A1,TBX21,NLRP3,ANO3,RSPO3,CD74,S100A10,CREB5,ADGRG6,LRRC9,CHODL,CPNE5,CD14,CD24A,CD3E,CPA6,UACA,VIP,ADAM12,CD209G,SPI1,NXPH2,PRR5L,MAF,ILDR2,CRISPLD1,IFNA2,IL10,IL22,H2-AB1,GAD2,FOXP2,NDST4,MRC1,LAMA1,LSP1,GDPD4,IL5,LCORL,ITGA8,MAML3,PRDM1,MEIS1,BGN,9330185C12RIK,CX3CR1,3222401L13RIK,A530053G22RIK,HS3ST3A1,FMO2,CNTNAP5A,ONECUT2,PLEKHG1,COL4A3,SFMBT2,GLIS3,CD1D1,CD19,ARHGAP6,CLEC10A,KCTD8,MEI1,ATP10B,TRPC6,PAPPA,5033421B08RIK,CASR,GREB1,CCR2,CD300C2,CHAT,CHRNA2,CCN2,C1QC,OSR1,OPALIN,NXPH4,NLRP1B,TREM2,TTR,TNF,TCAP,SLC6A20A,SYT6,SST,SNCG,SLC17A8,SMOC2,SDK1,SLC17A6,IGF1,TIPARP,NEAT1,MAN1A,IGF2BP3,CLDN34C1,ZFP804A,RXFP1,IL7R,IL2RB,TNC,CNTNAP5B,C130026I21RIK,RSPO1,RSKR,RORB,GBP10,MS4A1,ITGAM,ITGAX,KCNJ8,ITGB2,KLRK1,KLRB1,9530026P05RIK,SELPLG,CPNE9,CR2,IL12A,IL13,IL1B,IFNA12,EOMES,ENPP6,DRD1,CXCL9,CTLA4,CRISPLD2,LILRB4A,EXPH5,PRDM16,F13A1,FCGR1,ANO2,ANLN,AIF1,ABI3,AGBL1,,,,,,,,,,,,,,,,,,,,,,,,,,,,,,,,,,,,,,,,,,,,,,,,,,,,,,,,,,,,,,,,,,,,,,,,,,,,,,,,,,,,,,,,,,,,,,,,,,,,,,,,,,,,,,,,,,,,,,,,,,,,,,,,,,,,,,,,,,,,,,,,,,,,,,,,,,,,,,,,,,,,,,,,,,,,,,,,,,,,,,,,,,,,,,,,,,,,,,,,,,,,,,,,,,,,,,,,,,,,,,,,,,,,,,,,,,,,,,,,,,,,,,,,,,,,,,,,,,,,,,,,,,,,,,,,,,,,,,,,,,,,,,,,,,,,,,,,,,,,,,,,,,,,,,,,,,,,,,,,,,,,,,,,,,,,,,,,,,,,,,,,,,,,,,,,,,,,,,,,,,,,,,,,,,,,,,,,,,,,,,,,,,,,,,,,,,,,,,,,,,,,,,,,,,,,,,,,,,,,,,,,,,,,,,,,,,,,,,,,,,,,,,,,,,,,,,,,,,,,,,,,,,,,,,,,,,,,,,,,,,,,,,,,,,,,,,,,,,,,,,,,,,,,,,,,,,,,,,,,,,,,,,,,,,,,,,,,,,,,,,,,,,,,,,,,,,,,,,,,,,,,,,,,,,,,,,,,,,,,,,,,,,,,,,,,,,,,,,,,,,,,,,,,,,,,,,,,,,,,,,,,,,,normal,cortical layer V,oligodendrocyte precursor cell PDGFRA SOX10 OLIG1 SULF2 OLIG2 SLC17A7 SPTAN1 ALDOC CSPG4 APOE C4B FAM107A TCF25 ITPR2 TRIO SIRT2 KCNIP3 PLP1 NMNAT2 SPARC FTH1 SOX2OT CTSD SREBF2 GPC5 TTYH2 CD47 HIPK2 NCOR2 ADARB2 ZEB1 SERINC3 ABCA1 HMBOX1 NFKBIA RSRP1 BCL11B ZBTB20 TNKS MEF2C IFITM3 SCG2 MYT1L HMGB1 NFIA NFIB PARP1 ADRA1A BNC2 MBP SOX5 GRIN2B RAPGEFL1 TBR1 GAD1 NPAS3 CLIC4 DPYSL3 C1QL1 THRB FEZF2 CNR1 HMGCR CD9 EMID1 MFGE8 HIF3A AQP4 CTSB SERPINA3N GRIN3A SOX6 CDKN1A DIO2 CPNE7 SIRT7 SCUBE1 LAMP5 B2M RREB1 NR3C2 IL18 HSBP1 IRF7 SATB2 IFIT3 NPR3 CCL2 CREB3L2 AXL PTPRU PDE8A ASTN2 PTPRO CXCL10 LNPEP NFKB1 IL2RG PTGES2 CTPS SLC24A3 SPTB CYP27A1 CUX2 PROX1 IL15RA CLDN5 C1QA VWC2L ZC3HAV1 AFF3 GSG1L ITGAE TRIM30A FSTL5 BMP4 ARID5B IL2RA PDE10A BBX CALB2 TGFB2 ZFP827 FLT1 PITPNM3 FN1 CCND2 CGNL1 AFF1 OTOF FBLN2 SLC30A3 TCF7L1 EBF1 JAZF1 PCDHB16 LMO1 HEXB KCNIP2 CD38 CSRNP3 ZFHX3 KLRG1 EPB41L4A PDCD1 EIF5B KLF12 RORA 7630403G23RIK PARP14 TAP1 CHRM3 HIVEP3 NKAIN3 TEAD2 MXI1 NAMPT MYH11 HTR4 TGFB3 TNFSF8 E2F3 GBP6 VIM PVALB IRF3 CRHBP FOXP3 TMEM132C TRABD2B CALB1 MITF DRD2 ACTA2 FRMD4B TSHZ2 CDKN2B NFE2L2 SULF1 DGKA PARP4 CTSS SIRT3 IL6 NR4A2 DACH1 JDP2 EPHB1 ZFP385B IL33 PTPRC VIPR2 CDKN2A C3 SERPINF1 TGFB1 SP100 VTN PBX3 CAR3 DEPTOR PDE3A APLN XDH ADORA2A LHX6 CRH TRPS1 FBN2 B230323A14RIK FOXJ1 LYZ2 EGFR IFI44 GSDMD HPSE IL4 IL23A COL11A1 GRIN2C IFNA16 CRHR2 IL17A IL17F CSF1R GFAP IGF2 IFNG GATA3 PLEKHG3 RORC TH TOX2 BANP HS3ST4 NR6A1 SLC32A1 TBX21 NLRP3 ANO3 RSPO3 CD74 S100A10 CREB5 ADGRG6 LRRC9 CHODL CPNE5 CD14 CD24A CD3E CPA6 UACA VIP ADAM12 CD209G SPI1 NXPH2 PRR5L MAF ILDR2 CRISPLD1 IFNA2 IL10 IL22 H2-AB1 GAD2 FOXP2 NDST4 MRC1 LAMA1 LSP1 GDPD4 IL5 LCORL ITGA8 MAML3 PRDM1 MEIS1 BGN 9330185C12RIK CX3CR1 3222401L13RIK A530053G22RIK HS3ST3A1 FMO2 CNTNAP5A ONECUT2 PLEKHG1 COL4A3 SFMBT2 GLIS3 CD1D1 CD19 ARHGAP6 CLEC10A KCTD8 MEI1 ATP10B TRPC6 PAPPA 5033421B08RIK CASR GREB1 CCR2 CD300C2 CHAT CHRNA2 CCN2 C1QC OSR1 OPALIN NXPH4 NLRP1B TREM2 TTR TNF TCAP SLC6A20A SYT6 SST SNCG SLC17A8 SMOC2 SDK1 SLC17A6 IGF1 TIPARP NEAT1 MAN1A IGF2BP3 CLDN34C1 ZFP804A RXFP1 IL7R IL2RB TNC CNTNAP5B C130026I21RIK RSPO1 RSKR RORB GBP10 MS4A1 ITGAM ITGAX KCNJ8 ITGB2 KLRK1 KLRB1 9530026P05RIK SELPLG CPNE9 CR2 IL12A IL13 IL1B IFNA12 EOMES ENPP6 DRD1 CXCL9 CTLA4 CRISPLD2 LILRB4A EXPH5 PRDM16 F13A1 FCGR1 ANO2 ANLN AIF1 ABI3 AGBL1
