neuron,SLC17A7,LAMP5,SPTAN1,GRIN2B,MEF2C,RSRP1,TCF25,TBR1,CD47,SLC30A3,SATB2,CALB1,KCNIP2,CUX2,FTH1,MYT1L,SOX2OT,NMNAT2,LNPEP,BNC2,NCOR2,RAPGEFL1,GSG1L,TRIO,CNR1,CPNE9,ANO3,PDGFRA,PLP1,ILDR2,SERINC3,HIPK2,CHRM3,CTSD,NR3C2,PARP1,SULF2,CPNE5,KCNIP3,CTSB,ZEB1,SOX10,RREB1,EXPH5,SIRT2,SREBF2,NFIB,HMBOX1,ZFP827,FAM107A,CSRNP3,RORA,AFF3,PTPRU,SPARC,EIF5B,CRISPLD1,CTPS,OLIG1,SOX5,JDP2,OLIG2,TRPC6,SPTB,PITPNM3,B2M,THRB,HMGB1,BCL11B,PDE10A,TRPS1,EPB41L4A,HIF3A,TNKS,MBP,APOE,HEXB,CNTNAP5A,PCDHB16,CALB2,OTOF,NPR3,ALDOC,TTYH2,NFKBIA,BBX,ARID5B,CSF1R,HSBP1,CD24A,SIRT7,NAMPT,SIRT3,CCND2,HIVEP3,C4B,MEI1,PTGES2,HMGCR,ITGAE,ITGA8,PTPRO,IRF3,7630403G23RIK,ANLN,DPYSL3,NPAS3,ITPR2,CRH,C1QA,AFF1,IL12A,PDCD1,MITF,NLRP1B,DGKA,NR6A1,TIPARP,RSPO1,LCORL,EMID1,C1QL1,GAD1,NFKB1,TRABD2B,BMP4,CTSS,CX3CR1,TAP1,JAZF1,SMOC2,CDKN1A,RSPO3,FOXJ1,MAML3,GRIN3A,KLRG1,CSPG4,FOXP3,NFIA,DACH1,SERPINA3N,ASTN2,NEAT1,IL15RA,RORB,TMEM132C,DIO2,E2F3,SCUBE1,SULF1,SLC17A8,IL18,ANO2,IFIT3,UACA,EPHB1,ZBTB20,ADORA2A,CRHBP,IL2RA,ZFP385B,SLC32A1,GFAP,MFGE8,CCL2,CNTNAP5B,ENPP6,3222401L13RIK,MEIS1,CD14,CYP27A1,PLEKHG3,FOXP2,VWC2L,EBF1,GPC5,CCR2,ITGB2,ABCA1,TGFB1,DRD2,NR4A2,FN1,KLRB1,9530026P05RIK,CPA6,IL7R,TGFB3,RORC,PRR5L,PRDM16,GRIN2C,C1QC,PDE8A,ADRA1A,ZFP804A,DRD1,OSR1,SLC6A20A,CD9,VIM,CD1D1,MAF,CRHR2,CPNE7,S100A10,KLF12,C3,CDKN2A,SOX6,TH,EOMES,MYH11,SELPLG,ABI3,GBP6,VIP,KCTD8,CLIC4,ACTA2,ARHGAP6,DEPTOR,CHODL,TCF7L1,TRIM30A,SCG2,PARP14,PTPRC,SPI1,GSDMD,TREM2,GBP10,TNFSF8,CASR,IL2RB,IL17F,9330185C12RIK,SST,TGFB2,CD3E,MS4A1,ATP10B,LILRB4A,LHX6,OPALIN,IFNA2,H2-AB1,FCGR1,VIPR2,NFE2L2,ZFHX3,NXPH2,NLRP3,SYT6,SERPINF1,PVALB,SLC17A6,ADARB2,PDE3A,AQP4,TCAP,CGNL1,CDKN2B,CAR3,FSTL5,NXPH4,IRF7,IL17A,IL1B,FMO2,MXI1,IFI44,ADAM12,TOX2,TSHZ2,SLC24A3,MRC1,IL22,IL23A,CHRNA2,IL2RG,ITGAX,IL6,CD209G,ADGRG6,IGF2BP3,FEZF2,LRRC9,CLDN34C1,GDPD4,CREB3L2,HPSE,IFITM3,5033421B08RIK,LMO1,CREB5,TNF,CD38,PBX3,CD300C2,CD19,LYZ2,NDST4,TBX21,APLN,RSKR,PRDM1,RXFP1,BANP,SNCG,PROX1,FRMD4B,B230323A14RIK,FBN2,ZC3HAV1,LSP1,LAMA1,AIF1,PAPPA,CCN2,CHAT,PARP4,TEAD2,COL11A1,EGFR,BGN,GLIS3,SFMBT2,VTN,GREB1,TTR,IGF1,GAD2,F13A1,FLT1,MAN1A,A530053G22RIK,COL4A3,PLEKHG1,ONECUT2,HS3ST3A1,IL10,IGF2,IFNG,IFNA16,IFNA12,HTR4,GATA3,KLRK1,CD74,IL13,AXL,SP100,IL5,IL4,IL33,ITGAM,SDK1,HS3ST4,KCNJ8,CLDN5,XDH,C130026I21RIK,FBLN2,TNC,CR2,CLEC10A,NKAIN3,CXCL10,CRISPLD2,CXCL9,CTLA4,AGBL1,,,,,,,,,,,,,,,,,,,,,,,,,,,,,,,,,,,,,,,,,,,,,,,,,,,,,,,,,,,,,,,,,,,,,,,,,,,,,,,,,,,,,,,,,,,,,,,,,,,,,,,,,,,,,,,,,,,,,,,,,,,,,,,,,,,,,,,,,,,,,,,,,,,,,,,,,,,,,,,,,,,,,,,,,,,,,,,,,,,,,,,,,,,,,,,,,,,,,,,,,,,,,,,,,,,,,,,,,,,,,,,,,,,,,,,,,,,,,,,,,,,,,,,,,,,,,,,,,,,,,,,,,,,,,,,,,,,,,,,,,,,,,,,,,,,,,,,,,,,,,,,,,,,,,,,,,,,,,,,,,,,,,,,,,,,,,,,,,,,,,,,,,,,,,,,,,,,,,,,,,,,,,,,,,,,,,,,,,,,,,,,,,,,,,,,,,,,,,,,,,,,,,,,,,,,,,,,,,,,,,,,,,,,,,,,,,,,,,,,,,,,,,,,,,,,,,,,,,,,,,,,,,,,,,,,,,,,,,,,,,,,,,,,,,,,,,,,,,,,,,,,,,,,,,,,,,,,,,,,,,,,,,,,,,,,,,,,,,,,,,,,,,,,,,,,,,,,,,,,,,,,,,,,,,,,,,,,,,,,,,,,,,,,,,,,,,,,,,,,,,,,,,,,,,,,,,,,,,,,,,,,,,,,normal,cortical layer II/III,neuron SLC17A7 LAMP5 SPTAN1 GRIN2B MEF2C RSRP1 TCF25 TBR1 CD47 SLC30A3 SATB2 CALB1 KCNIP2 CUX2 FTH1 MYT1L SOX2OT NMNAT2 LNPEP BNC2 NCOR2 RAPGEFL1 GSG1L TRIO CNR1 CPNE9 ANO3 PDGFRA PLP1 ILDR2 SERINC3 HIPK2 CHRM3 CTSD NR3C2 PARP1 SULF2 CPNE5 KCNIP3 CTSB ZEB1 SOX10 RREB1 EXPH5 SIRT2 SREBF2 NFIB HMBOX1 ZFP827 FAM107A CSRNP3 RORA AFF3 PTPRU SPARC EIF5B CRISPLD1 CTPS OLIG1 SOX5 JDP2 OLIG2 TRPC6 SPTB PITPNM3 B2M THRB HMGB1 BCL11B PDE10A TRPS1 EPB41L4A HIF3A TNKS MBP APOE HEXB CNTNAP5A PCDHB16 CALB2 OTOF NPR3 ALDOC TTYH2 NFKBIA BBX ARID5B CSF1R HSBP1 CD24A SIRT7 NAMPT SIRT3 CCND2 HIVEP3 C4B MEI1 PTGES2 HMGCR ITGAE ITGA8 PTPRO IRF3 7630403G23RIK ANLN DPYSL3 NPAS3 ITPR2 CRH C1QA AFF1 IL12A PDCD1 MITF NLRP1B DGKA NR6A1 TIPARP RSPO1 LCORL EMID1 C1QL1 GAD1 NFKB1 TRABD2B BMP4 CTSS CX3CR1 TAP1 JAZF1 SMOC2 CDKN1A RSPO3 FOXJ1 MAML3 GRIN3A KLRG1 CSPG4 FOXP3 NFIA DACH1 SERPINA3N ASTN2 NEAT1 IL15RA RORB TMEM132C DIO2 E2F3 SCUBE1 SULF1 SLC17A8 IL18 ANO2 IFIT3 UACA EPHB1 ZBTB20 ADORA2A CRHBP IL2RA ZFP385B SLC32A1 GFAP MFGE8 CCL2 CNTNAP5B ENPP6 3222401L13RIK MEIS1 CD14 CYP27A1 PLEKHG3 FOXP2 VWC2L EBF1 GPC5 CCR2 ITGB2 ABCA1 TGFB1 DRD2 NR4A2 FN1 KLRB1 9530026P05RIK CPA6 IL7R TGFB3 RORC PRR5L PRDM16 GRIN2C C1QC PDE8A ADRA1A ZFP804A DRD1 OSR1 SLC6A20A CD9 VIM CD1D1 MAF CRHR2 CPNE7 S100A10 KLF12 C3 CDKN2A SOX6 TH EOMES MYH11 SELPLG ABI3 GBP6 VIP KCTD8 CLIC4 ACTA2 ARHGAP6 DEPTOR CHODL TCF7L1 TRIM30A SCG2 PARP14 PTPRC SPI1 GSDMD TREM2 GBP10 TNFSF8 CASR IL2RB IL17F 9330185C12RIK SST TGFB2 CD3E MS4A1 ATP10B LILRB4A LHX6 OPALIN IFNA2 H2-AB1 FCGR1 VIPR2 NFE2L2 ZFHX3 NXPH2 NLRP3 SYT6 SERPINF1 PVALB SLC17A6 ADARB2 PDE3A AQP4 TCAP CGNL1 CDKN2B CAR3 FSTL5 NXPH4 IRF7 IL17A IL1B FMO2 MXI1 IFI44 ADAM12 TOX2 TSHZ2 SLC24A3 MRC1 IL22 IL23A CHRNA2 IL2RG ITGAX IL6 CD209G ADGRG6 IGF2BP3 FEZF2 LRRC9 CLDN34C1 GDPD4 CREB3L2 HPSE IFITM3 5033421B08RIK LMO1 CREB5 TNF CD38 PBX3 CD300C2 CD19 LYZ2 NDST4 TBX21 APLN RSKR PRDM1 RXFP1 BANP SNCG PROX1 FRMD4B B230323A14RIK FBN2 ZC3HAV1 LSP1 LAMA1 AIF1 PAPPA CCN2 CHAT PARP4 TEAD2 COL11A1 EGFR BGN GLIS3 SFMBT2 VTN GREB1 TTR IGF1 GAD2 F13A1 FLT1 MAN1A A530053G22RIK COL4A3 PLEKHG1 ONECUT2 HS3ST3A1 IL10 IGF2 IFNG IFNA16 IFNA12 HTR4 GATA3 KLRK1 CD74 IL13 AXL SP100 IL5 IL4 IL33 ITGAM SDK1 HS3ST4 KCNJ8 CLDN5 XDH C130026I21RIK FBLN2 TNC CR2 CLEC10A NKAIN3 CXCL10 CRISPLD2 CXCL9 CTLA4 AGBL1
neuron,SLC17A7,TCF25,SPTAN1,TBR1,RSRP1,FTH1,GRIN2B,CD47,SULF2,MYT1L,RAPGEFL1,SATB2,NMNAT2,MEF2C,NCOR2,SPARC,ALDOC,TRIO,SOX2OT,TSHZ2,LNPEP,KCNIP3,CTSD,BCL11B,ILDR2,SREBF2,CTSB,BNC2,FAM107A,APOE,MBP,NFKBIA,SIRT2,FEZF2,NFIB,PCDHB16,CNR1,HIVEP3,HMBOX1,PARP1,ZFP827,TTYH2,ZEB1,PITPNM3,AFF3,THRB,CSRNP3,SOX10,PTPRU,TNKS,OLIG1,SLC30A3,ANO3,PLP1,JDP2,B2M,MFGE8,SIRT3,CTPS,RORB,CPNE9,EIF5B,SERINC3,HMGB1,RREB1,PDGFRA,SCUBE1,HMGCR,CNTNAP5A,ASTN2,CDKN1A,KLF12,HSBP1,SLC17A6,DEPTOR,HS3ST4,HEXB,OLIG2,RORA,KCNIP2,PDE10A,SOX5,VWC2L,BMP4,C4B,NFKB1,MXI1,DIO2,HIF3A,NEAT1,DGKA,NAMPT,7630403G23RIK,HIPK2,GSG1L,BBX,CPNE7,NR3C2,TRABD2B,SPTB,GAD1,CALB2,IL18,NFIA,CD24A,RXFP1,TRPS1,SIRT7,DRD1,EXPH5,TOX2,CSPG4,PTPRO,SLC24A3,SULF1,HTR4,ZFP385B,ITPR2,TMEM132C,SERPINA3N,PTGES2,E2F3,ABCA1,SCG2,IRF3,IRF7,ZFP804A,ZBTB20,EPB41L4A,ZC3HAV1,ZFHX3,AQP4,NXPH2,TH,GPC5,CLDN5,KCTD8,TAP1,CSF1R,FOXP2,GFAP,NPAS3,CYP27A1,ADGRG6,OTOF,NKAIN3,CRH,TGFB3,OPALIN,ARID5B,IL33,DPYSL3,MYH11,PDCD1,DACH1,SYT6,LMO1,SOX6,MITF,CPNE5,MAN1A,UACA,AFF1,PLEKHG3,CLIC4,TIPARP,C3,CRHBP,NFE2L2,SPI1,CDKN2A,EMID1,IL12A,FLT1,LAMP5,ABI3,TRIM30A,KLRG1,CD3E,JAZF1,CHRM3,EGFR,IFITM3,MS4A1,IL2RA,ONECUT2,S100A10,FN1,RORC,C1QL1,TCAP,FOXP3,IL2RB,ITGAM,IL15RA,CGNL1,ITGA8,LHX6,AXL,ADARB2,CHRNA2,GLIS3,GRIN3A,CCND2,COL11A1,FOXJ1,APLN,NLRP1B,MAML3,ITGAX,AGBL1,IGF2,FRMD4B,PROX1,XDH,CD209G,ITGAE,BANP,NR4A2,VTN,IL10,ADAM12,SERPINF1,SFMBT2,ANLN,PDE8A,PBX3,CNTNAP5B,GRIN2C,MEI1,CUX2,NLRP3,CD9,GBP10,SP100,PARP4,TTR,PVALB,IFNA12,IL4,LCORL,IL17A,CTSS,PARP14,FSTL5,OSR1,NPR3,ADORA2A,LSP1,H2-AB1,IL1B,IFI44,LRRC9,TNFSF8,FBLN2,CX3CR1,9330185C12RIK,C1QA,RSPO1,5033421B08RIK,ANO2,MAF,CD74,NDST4,CHAT,IL22,GAD2,GBP6,CPA6,IL6,CCL2,C130026I21RIK,FBN2,NR6A1,RSPO3,SLC32A1,IGF1,EOMES,TNF,CCN2,CDKN2B,SLC17A8,CRHR2,CXCL9,IL7R,SMOC2,VIM,TREM2,TCF7L1,SST,CLEC10A,SELPLG,ATP10B,TBX21,SDK1,CD38,IL17F,IFIT3,PTPRC,GDPD4,EBF1,CREB3L2,ACTA2,MEIS1,ARHGAP6,PLEKHG1,CD14,BGN,B230323A14RIK,TGFB1,F13A1,GREB1,KLRK1,GSDMD,PRDM16,ADRA1A,3222401L13RIK,CAR3,EPHB1,CTLA4,PRR5L,IL23A,DRD2,IGF2BP3,PAPPA,ENPP6,TRPC6,CD19,LYZ2,RSKR,PRDM1,CD300C2,CLDN34C1,CREB5,SLC6A20A,COL4A3,CCR2,C1QC,CHODL,CALB1,CD1D1,NXPH4,A530053G22RIK,VIP,VIPR2,CASR,SNCG,TGFB2,TEAD2,LAMA1,KLRB1,KCNJ8,ITGB2,IL5,MRC1,HS3ST3A1,FMO2,IL2RG,IFNG,IFNA2,IFNA16,HPSE,GATA3,IL13,9530026P05RIK,TNC,CXCL10,CRISPLD2,CR2,FCGR1,LILRB4A,PDE3A,CRISPLD1,AIF1,,,,,,,,,,,,,,,,,,,,,,,,,,,,,,,,,,,,,,,,,,,,,,,,,,,,,,,,,,,,,,,,,,,,,,,,,,,,,,,,,,,,,,,,,,,,,,,,,,,,,,,,,,,,,,,,,,,,,,,,,,,,,,,,,,,,,,,,,,,,,,,,,,,,,,,,,,,,,,,,,,,,,,,,,,,,,,,,,,,,,,,,,,,,,,,,,,,,,,,,,,,,,,,,,,,,,,,,,,,,,,,,,,,,,,,,,,,,,,,,,,,,,,,,,,,,,,,,,,,,,,,,,,,,,,,,,,,,,,,,,,,,,,,,,,,,,,,,,,,,,,,,,,,,,,,,,,,,,,,,,,,,,,,,,,,,,,,,,,,,,,,,,,,,,,,,,,,,,,,,,,,,,,,,,,,,,,,,,,,,,,,,,,,,,,,,,,,,,,,,,,,,,,,,,,,,,,,,,,,,,,,,,,,,,,,,,,,,,,,,,,,,,,,,,,,,,,,,,,,,,,,,,,,,,,,,,,,,,,,,,,,,,,,,,,,,,,,,,,,,,,,,,,,,,,,,,,,,,,,,,,,,,,,,,,,,,,,,,,,,,,,,,,,,,,,,,,,,,,,,,,,,,,,,,,,,,,,,,,,,,,,,,,,,,,,,,,,,,,,,,,,,,,,,,,,,,,,,,,,,,,,,,,,normal,cortical layer V,neuron SLC17A7 TCF25 SPTAN1 TBR1 RSRP1 FTH1 GRIN2B CD47 SULF2 MYT1L RAPGEFL1 SATB2 NMNAT2 MEF2C NCOR2 SPARC ALDOC TRIO SOX2OT TSHZ2 LNPEP KCNIP3 CTSD BCL11B ILDR2 SREBF2 CTSB BNC2 FAM107A APOE MBP NFKBIA SIRT2 FEZF2 NFIB PCDHB16 CNR1 HIVEP3 HMBOX1 PARP1 ZFP827 TTYH2 ZEB1 PITPNM3 AFF3 THRB CSRNP3 SOX10 PTPRU TNKS OLIG1 SLC30A3 ANO3 PLP1 JDP2 B2M MFGE8 SIRT3 CTPS RORB CPNE9 EIF5B SERINC3 HMGB1 RREB1 PDGFRA SCUBE1 HMGCR CNTNAP5A ASTN2 CDKN1A KLF12 HSBP1 SLC17A6 DEPTOR HS3ST4 HEXB OLIG2 RORA KCNIP2 PDE10A SOX5 VWC2L BMP4 C4B NFKB1 MXI1 DIO2 HIF3A NEAT1 DGKA NAMPT 7630403G23RIK HIPK2 GSG1L BBX CPNE7 NR3C2 TRABD2B SPTB GAD1 CALB2 IL18 NFIA CD24A RXFP1 TRPS1 SIRT7 DRD1 EXPH5 TOX2 CSPG4 PTPRO SLC24A3 SULF1 HTR4 ZFP385B ITPR2 TMEM132C SERPINA3N PTGES2 E2F3 ABCA1 SCG2 IRF3 IRF7 ZFP804A ZBTB20 EPB41L4A ZC3HAV1 ZFHX3 AQP4 NXPH2 TH GPC5 CLDN5 KCTD8 TAP1 CSF1R FOXP2 GFAP NPAS3 CYP27A1 ADGRG6 OTOF NKAIN3 CRH TGFB3 OPALIN ARID5B IL33 DPYSL3 MYH11 PDCD1 DACH1 SYT6 LMO1 SOX6 MITF CPNE5 MAN1A UACA AFF1 PLEKHG3 CLIC4 TIPARP C3 CRHBP NFE2L2 SPI1 CDKN2A EMID1 IL12A FLT1 LAMP5 ABI3 TRIM30A KLRG1 CD3E JAZF1 CHRM3 EGFR IFITM3 MS4A1 IL2RA ONECUT2 S100A10 FN1 RORC C1QL1 TCAP FOXP3 IL2RB ITGAM IL15RA CGNL1 ITGA8 LHX6 AXL ADARB2 CHRNA2 GLIS3 GRIN3A CCND2 COL11A1 FOXJ1 APLN NLRP1B MAML3 ITGAX AGBL1 IGF2 FRMD4B PROX1 XDH CD209G ITGAE BANP NR4A2 VTN IL10 ADAM12 SERPINF1 SFMBT2 ANLN PDE8A PBX3 CNTNAP5B GRIN2C MEI1 CUX2 NLRP3 CD9 GBP10 SP100 PARP4 TTR PVALB IFNA12 IL4 LCORL IL17A CTSS PARP14 FSTL5 OSR1 NPR3 ADORA2A LSP1 H2-AB1 IL1B IFI44 LRRC9 TNFSF8 FBLN2 CX3CR1 9330185C12RIK C1QA RSPO1 5033421B08RIK ANO2 MAF CD74 NDST4 CHAT IL22 GAD2 GBP6 CPA6 IL6 CCL2 C130026I21RIK FBN2 NR6A1 RSPO3 SLC32A1 IGF1 EOMES TNF CCN2 CDKN2B SLC17A8 CRHR2 CXCL9 IL7R SMOC2 VIM TREM2 TCF7L1 SST CLEC10A SELPLG ATP10B TBX21 SDK1 CD38 IL17F IFIT3 PTPRC GDPD4 EBF1 CREB3L2 ACTA2 MEIS1 ARHGAP6 PLEKHG1 CD14 BGN B230323A14RIK TGFB1 F13A1 GREB1 KLRK1 GSDMD PRDM16 ADRA1A 3222401L13RIK CAR3 EPHB1 CTLA4 PRR5L IL23A DRD2 IGF2BP3 PAPPA ENPP6 TRPC6 CD19 LYZ2 RSKR PRDM1 CD300C2 CLDN34C1 CREB5 SLC6A20A COL4A3 CCR2 C1QC CHODL CALB1 CD1D1 NXPH4 A530053G22RIK VIP VIPR2 CASR SNCG TGFB2 TEAD2 LAMA1 KLRB1 KCNJ8 ITGB2 IL5 MRC1 HS3ST3A1 FMO2 IL2RG IFNG IFNA2 IFNA16 HPSE GATA3 IL13 9530026P05RIK TNC CXCL10 CRISPLD2 CR2 FCGR1 LILRB4A PDE3A CRISPLD1 AIF1
neuron,SLC17A7,SPTAN1,TCF25,RSRP1,SULF2,ALDOC,TBR1,CD47,FTH1,RAPGEFL1,GRIN2B,NCOR2,MYT1L,SOX2OT,BCL11B,FEZF2,NMNAT2,APOE,MEF2C,HS3ST4,ASTN2,PLP1,SATB2,LNPEP,TSHZ2,TRIO,SREBF2,PDGFRA,ANO3,OLIG1,CTSB,CTSD,NFIB,HIPK2,HMBOX1,SPARC,NFKBIA,FAM107A,OLIG2,SOX10,CPNE7,CSRNP3,RORA,KCNIP3,VWC2L,SIRT2,SERINC3,JAZF1,HEXB,LAMP5,PDE10A,HSBP1,PTPRU,TRABD2B,PITPNM3,AFF3,B2M,NAMPT,MBP,TNKS,THRB,HMGB1,JDP2,KLF12,ZEB1,BNC2,NEAT1,SOX5,ZFP827,EIF5B,SIRT3,ABCA1,PCDHB16,HMGCR,PTGES2,CNTNAP5A,CTPS,ITPR2,PARP1,NXPH2,NFIA,GSG1L,KCNIP2,SLC17A6,C1QL1,FSTL5,CSPG4,NR3C2,MITF,IL15RA,ARID5B,C4B,SYT6,TTYH2,GAD1,FOXP2,SCG2,DEPTOR,ILDR2,CNR1,HIVEP3,IL18,NKAIN3,HTR4,CNTNAP5B,NR6A1,SOX6,BMP4,PDCD1,CCND2,RREB1,ZFP804A,PTPRO,EPHB1,SLC30A3,CALB2,DRD1,CHRM3,GPC5,MFGE8,PVALB,CDKN1A,EPB41L4A,SIRT7,RXFP1,E2F3,NFKB1,ZFP385B,SPTB,7630403G23RIK,IL33,CRH,PDE8A,KLRG1,CPNE9,ADRA1A,SLC17A8,IL2RA,HIF3A,TGFB3,MAN1A,BBX,GAD2,GFAP,SERPINA3N,ENPP6,DGKA,ONECUT2,NPR3,IRF3,S100A10,DACH1,IL2RG,SDK1,MXI1,IL13,CRHBP,IL12A,EMID1,ITGAE,RORB,AXL,CD24A,AFF1,EXPH5,BANP,ZBTB20,ATP10B,PLEKHG3,CDKN2A,SPI1,SULF1,C3,TOX2,C1QA,3222401L13RIK,IFI44,TIPARP,TRPS1,ADARB2,KCTD8,PAPPA,OTOF,IGF2BP3,NR4A2,DIO2,LMO1,CLIC4,OPALIN,IL7R,ACTA2,ADORA2A,MYH11,LSP1,IFNA16,SLC24A3,LRRC9,CPNE5,TH,ZFHX3,MAF,RORC,VIPR2,IL17F,DPYSL3,FRMD4B,EOMES,CHRNA2,CPA6,IRF7,TCF7L1,CGNL1,IL22,GRIN3A,PRDM1,IL6,CLDN34C1,CCL2,CRISPLD1,FBLN2,GDPD4,DRD2,IL10,GRIN2C,GSDMD,IFNA2,SNCG,CD14,IL4,PTPRC,ITGA8,TMEM132C,CX3CR1,FOXJ1,SELPLG,VIP,NDST4,ITGAX,CD74,TCAP,UACA,TRIM30A,NXPH4,IL5,CCN2,CCR2,H2-AB1,CYP27A1,ZC3HAV1,AGBL1,ANO2,9330185C12RIK,PARP4,FBN2,LCORL,CR2,IL1B,TAP1,SST,SLC32A1,CHAT,C1QC,MS4A1,XDH,PROX1,CTSS,EGFR,IFNA12,MRC1,HPSE,ABI3,AQP4,ANLN,RSPO3,EBF1,CD300C2,CD19,PBX3,NLRP3,NFE2L2,IFIT3,CD209G,TNF,KCNJ8,IL2RB,NLRP1B,ITGAM,FN1,CUX2,9530026P05RIK,GBP6,CD9,CALB1,CAR3,TEAD2,TNFSF8,LYZ2,CLEC10A,CHODL,CLDN5,CD3E,CDKN2B,CD1D1,TGFB1,TGFB2,TTR,SP100,TRPC6,MEI1,CREB5,ITGB2,IL23A,RSPO1,OSR1,PARP14,RSKR,SCUBE1,CREB3L2,PRR5L,HS3ST3A1,FMO2,IGF1,TREM2,ADAM12,NPAS3,ARHGAP6,GLIS3,ADGRG6,GREB1,CASR,5033421B08RIK,VTN,A530053G22RIK,SFMBT2,SERPINF1,COL4A3,PLEKHG1,SMOC2,SLC6A20A,TBX21,MAML3,KLRB1,CRISPLD2,CRHR2,IGF2,IL17A,IFNG,GATA3,FOXP3,IFITM3,GBP10,KLRK1,LAMA1,LHX6,TNC,C130026I21RIK,COL11A1,CD38,LILRB4A,PDE3A,FCGR1,FLT1,F13A1,CTLA4,CXCL10,CXCL9,CSF1R,VIM,PRDM16,B230323A14RIK,BGN,APLN,MEIS1,AIF1,,,,,,,,,,,,,,,,,,,,,,,,,,,,,,,,,,,,,,,,,,,,,,,,,,,,,,,,,,,,,,,,,,,,,,,,,,,,,,,,,,,,,,,,,,,,,,,,,,,,,,,,,,,,,,,,,,,,,,,,,,,,,,,,,,,,,,,,,,,,,,,,,,,,,,,,,,,,,,,,,,,,,,,,,,,,,,,,,,,,,,,,,,,,,,,,,,,,,,,,,,,,,,,,,,,,,,,,,,,,,,,,,,,,,,,,,,,,,,,,,,,,,,,,,,,,,,,,,,,,,,,,,,,,,,,,,,,,,,,,,,,,,,,,,,,,,,,,,,,,,,,,,,,,,,,,,,,,,,,,,,,,,,,,,,,,,,,,,,,,,,,,,,,,,,,,,,,,,,,,,,,,,,,,,,,,,,,,,,,,,,,,,,,,,,,,,,,,,,,,,,,,,,,,,,,,,,,,,,,,,,,,,,,,,,,,,,,,,,,,,,,,,,,,,,,,,,,,,,,,,,,,,,,,,,,,,,,,,,,,,,,,,,,,,,,,,,,,,,,,,,,,,,,,,,,,,,,,,,,,,,,,,,,,,,,,,,,,,,,,,,,,,,,,,,,,,,,,,,,,,,,,,,,,,,,,,,,,,,,,,,,,,,,,,,,,,,,,,,,,,,,,,,,,,,,,,,,,,,,,,,,,,,,normal,cortical layer VI,neuron SLC17A7 SPTAN1 TCF25 RSRP1 SULF2 ALDOC TBR1 CD47 FTH1 RAPGEFL1 GRIN2B NCOR2 MYT1L SOX2OT BCL11B FEZF2 NMNAT2 APOE MEF2C HS3ST4 ASTN2 PLP1 SATB2 LNPEP TSHZ2 TRIO SREBF2 PDGFRA ANO3 OLIG1 CTSB CTSD NFIB HIPK2 HMBOX1 SPARC NFKBIA FAM107A OLIG2 SOX10 CPNE7 CSRNP3 RORA KCNIP3 VWC2L SIRT2 SERINC3 JAZF1 HEXB LAMP5 PDE10A HSBP1 PTPRU TRABD2B PITPNM3 AFF3 B2M NAMPT MBP TNKS THRB HMGB1 JDP2 KLF12 ZEB1 BNC2 NEAT1 SOX5 ZFP827 EIF5B SIRT3 ABCA1 PCDHB16 HMGCR PTGES2 CNTNAP5A CTPS ITPR2 PARP1 NXPH2 NFIA GSG1L KCNIP2 SLC17A6 C1QL1 FSTL5 CSPG4 NR3C2 MITF IL15RA ARID5B C4B SYT6 TTYH2 GAD1 FOXP2 SCG2 DEPTOR ILDR2 CNR1 HIVEP3 IL18 NKAIN3 HTR4 CNTNAP5B NR6A1 SOX6 BMP4 PDCD1 CCND2 RREB1 ZFP804A PTPRO EPHB1 SLC30A3 CALB2 DRD1 CHRM3 GPC5 MFGE8 PVALB CDKN1A EPB41L4A SIRT7 RXFP1 E2F3 NFKB1 ZFP385B SPTB 7630403G23RIK IL33 CRH PDE8A KLRG1 CPNE9 ADRA1A SLC17A8 IL2RA HIF3A TGFB3 MAN1A BBX GAD2 GFAP SERPINA3N ENPP6 DGKA ONECUT2 NPR3 IRF3 S100A10 DACH1 IL2RG SDK1 MXI1 IL13 CRHBP IL12A EMID1 ITGAE RORB AXL CD24A AFF1 EXPH5 BANP ZBTB20 ATP10B PLEKHG3 CDKN2A SPI1 SULF1 C3 TOX2 C1QA 3222401L13RIK IFI44 TIPARP TRPS1 ADARB2 KCTD8 PAPPA OTOF IGF2BP3 NR4A2 DIO2 LMO1 CLIC4 OPALIN IL7R ACTA2 ADORA2A MYH11 LSP1 IFNA16 SLC24A3 LRRC9 CPNE5 TH ZFHX3 MAF RORC VIPR2 IL17F DPYSL3 FRMD4B EOMES CHRNA2 CPA6 IRF7 TCF7L1 CGNL1 IL22 GRIN3A PRDM1 IL6 CLDN34C1 CCL2 CRISPLD1 FBLN2 GDPD4 DRD2 IL10 GRIN2C GSDMD IFNA2 SNCG CD14 IL4 PTPRC ITGA8 TMEM132C CX3CR1 FOXJ1 SELPLG VIP NDST4 ITGAX CD74 TCAP UACA TRIM30A NXPH4 IL5 CCN2 CCR2 H2-AB1 CYP27A1 ZC3HAV1 AGBL1 ANO2 9330185C12RIK PARP4 FBN2 LCORL CR2 IL1B TAP1 SST SLC32A1 CHAT C1QC MS4A1 XDH PROX1 CTSS EGFR IFNA12 MRC1 HPSE ABI3 AQP4 ANLN RSPO3 EBF1 CD300C2 CD19 PBX3 NLRP3 NFE2L2 IFIT3 CD209G TNF KCNJ8 IL2RB NLRP1B ITGAM FN1 CUX2 9530026P05RIK GBP6 CD9 CALB1 CAR3 TEAD2 TNFSF8 LYZ2 CLEC10A CHODL CLDN5 CD3E CDKN2B CD1D1 TGFB1 TGFB2 TTR SP100 TRPC6 MEI1 CREB5 ITGB2 IL23A RSPO1 OSR1 PARP14 RSKR SCUBE1 CREB3L2 PRR5L HS3ST3A1 FMO2 IGF1 TREM2 ADAM12 NPAS3 ARHGAP6 GLIS3 ADGRG6 GREB1 CASR 5033421B08RIK VTN A530053G22RIK SFMBT2 SERPINF1 COL4A3 PLEKHG1 SMOC2 SLC6A20A TBX21 MAML3 KLRB1 CRISPLD2 CRHR2 IGF2 IL17A IFNG GATA3 FOXP3 IFITM3 GBP10 KLRK1 LAMA1 LHX6 TNC C130026I21RIK COL11A1 CD38 LILRB4A PDE3A FCGR1 FLT1 F13A1 CTLA4 CXCL10 CXCL9 CSF1R VIM PRDM16 B230323A14RIK BGN APLN MEIS1 AIF1
neuron,SLC17A7,SPTAN1,GRIN2B,RSRP1,BNC2,MEF2C,RAPGEFL1,TBR1,CD47,SLC30A3,MYT1L,ALDOC,ILDR2,NFIB,CPNE7,CNR1,TCF25,BCL11B,SPARC,SOX2OT,KCNIP3,CLIC4,TRIO,LAMP5,HMGB1,CUX2,ANO3,SERINC3,FTH1,NMNAT2,CNTNAP5A,PLP1,SULF2,LNPEP,CD24A,PDGFRA,TNKS,OLIG1,7630403G23RIK,GSG1L,TRPC6,FAM107A,ZEB1,PARP1,CLDN5,NCOR2,NR3C2,ABCA1,EPB41L4A,CCND2,HMBOX1,SOX10,FLT1,RREB1,ITGA8,CTPS,IL18,CPNE5,SREBF2,CSPG4,IL2RA,NFKBIA,NDST4,PITPNM3,SIRT2,MXI1,ZFP827,CTSD,MBP,AFF1,NR4A2,APOE,HSBP1,NFIA,SOX5,C3,CALB2,CSRNP3,B2M,DEPTOR,KLF12,CDKN1A,SULF1,VIM,PCDHB16,DIO2,DPYSL3,EXPH5,CGNL1,CDKN2A,HIVEP3,PTPRO,FSTL5,IL15RA,HTR4,CD38,TTYH2,SERPINA3N,TSHZ2,SOX6,CTSB,PDCD1,NPR3,SATB2,PTGES2,TRABD2B,SIRT7,AFF3,PDE10A,TGFB3,THRB,ANO2,CHRM3,C4B,CALB1,HMGCR,E2F3,PDE8A,ZBTB20,IL13,IL12A,GFAP,IGF2,IFIT3,GRIN2C,FOXP2,HEXB,GATA3,FOXP3,IL17F,CD19,CD3E,EGFR,DRD1,CTSS,NKAIN3,CPA6,CD14,ZFHX3,EPHB1,HIPK2,CHRNA2,LYZ2,OLIG2,CLEC10A,HIF3A,TRPS1,CNTNAP5B,NLRP3,TH,NXPH2,SCUBE1,TCF7L1,ZFP804A,BANP,FMO2,CREB3L2,RSPO1,RORC,PRDM1,LCORL,KLRG1,KCNIP2,ITPR2,MS4A1,MRC1,LSP1,LHX6,IRF3,ADAM12,IL23A,ITGAE,IL22,NEAT1,CD209G,CLDN34C1,BBX,SDK1,ZFP385B,9530026P05RIK,NFKB1,NXPH4,PVALB,UACA,CASR,TRIM30A,SMOC2,SNCG,TREM2,SFMBT2,ARID5B,TAP1,SLC24A3,PARP4,VWC2L,CRH,CPNE9,CRISPLD1,GPC5,BGN,CD9,RSPO3,S100A10,CRISPLD2,CSF1R,CRHBP,JDP2,EIF5B,TEAD2,CD300C2,AGBL1,ABI3,ACTA2,ADORA2A,AIF1,ANLN,APLN,ARHGAP6,KCTD8,JAZF1,MEI1,BMP4,CD74,ATP10B,CREB5,PAPPA,DGKA,ADRA1A,CR2,CRHR2,ASTN2,ZC3HAV1,MITF,ADARB2,NAMPT,RORA,FBN2,FRMD4B,B230323A14RIK,TTR,VIP,VIPR2,VTN,5033421B08RIK,GREB1,LRRC9,SPTB,ADGRG6,GLIS3,COL4A3,PLEKHG1,ONECUT2,A530053G22RIK,TIPARP,EBF1,SELPLG,SERPINF1,SLC17A6,SLC17A8,SLC32A1,SLC6A20A,SPI1,SST,SYT6,TBX21,TCAP,TGFB1,TGFB2,TMEM132C,TNF,NLRP1B,OPALIN,OSR1,OTOF,PARP14,PLEKHG3,PROX1,PTPRC,PTPRU,RORB,RSKR,RXFP1,IGF1,HS3ST3A1,TOX2,PRR5L,MAF,NFE2L2,GRIN3A,NPAS3,IGF2BP3,MAN1A,AXL,NR6A1,HS3ST4,IL2RB,IL2RG,IL33,IL4,IL5,IL6,IL7R,IRF7,ITGAM,ITGAX,ITGB2,KCNJ8,KLRB1,KLRK1,LAMA1,LMO1,MFGE8,MYH11,FBLN2,MAML3,C130026I21RIK,XDH,TNC,COL11A1,FOXJ1,GAD1,GAD2,GBP10,GBP6,GDPD4,GSDMD,H2-AB1,HPSE,IFI44,IFITM3,IFNA12,IFNA16,IFNA2,IFNG,IL10,IL17A,IL1B,MEIS1,SCG2,9330185C12RIK,CX3CR1,CXCL10,CXCL9,CYP27A1,DRD2,EMID1,ENPP6,EOMES,F13A1,FCGR1,FEZF2,FN1,PDE3A,LILRB4A,3222401L13RIK,SIRT3,CCL2,CCN2,CCR2,CD1D1,AQP4,CDKN2B,CHAT,CHODL,DACH1,SP100,CTLA4,TNFSF8,PRDM16,CAR3,PBX3,C1QL1,C1QC,C1QA,,,,,,,,,,,,,,,,,,,,,,,,,,,,,,,,,,,,,,,,,,,,,,,,,,,,,,,,,,,,,,,,,,,,,,,,,,,,,,,,,,,,,,,,,,,,,,,,,,,,,,,,,,,,,,,,,,,,,,,,,,,,,,,,,,,,,,,,,,,,,,,,,,,,,,,,,,,,,,,,,,,,,,,,,,,,,,,,,,,,,,,,,,,,,,,,,,,,,,,,,,,,,,,,,,,,,,,,,,,,,,,,,,,,,,,,,,,,,,,,,,,,,,,,,,,,,,,,,,,,,,,,,,,,,,,,,,,,,,,,,,,,,,,,,,,,,,,,,,,,,,,,,,,,,,,,,,,,,,,,,,,,,,,,,,,,,,,,,,,,,,,,,,,,,,,,,,,,,,,,,,,,,,,,,,,,,,,,,,,,,,,,,,,,,,,,,,,,,,,,,,,,,,,,,,,,,,,,,,,,,,,,,,,,,,,,,,,,,,,,,,,,,,,,,,,,,,,,,,,,,,,,,,,,,,,,,,,,,,,,,,,,,,,,,,,,,,,,,,,,,,,,,,,,,,,,,,,,,,,,,,,,,,,,,,,,,,,,,,,,,,,,,,,,,,,,,,,,,,,,,,,,,,,,,,,,,,,,,,,,,,,,,,,,,,,,,,,,,,,,,,,,,,,,,,,,,,,,,,,,,,,,,,,normal,olfactory region,neuron SLC17A7 SPTAN1 GRIN2B RSRP1 BNC2 MEF2C RAPGEFL1 TBR1 CD47 SLC30A3 MYT1L ALDOC ILDR2 NFIB CPNE7 CNR1 TCF25 BCL11B SPARC SOX2OT KCNIP3 CLIC4 TRIO LAMP5 HMGB1 CUX2 ANO3 SERINC3 FTH1 NMNAT2 CNTNAP5A PLP1 SULF2 LNPEP CD24A PDGFRA TNKS OLIG1 7630403G23RIK GSG1L TRPC6 FAM107A ZEB1 PARP1 CLDN5 NCOR2 NR3C2 ABCA1 EPB41L4A CCND2 HMBOX1 SOX10 FLT1 RREB1 ITGA8 CTPS IL18 CPNE5 SREBF2 CSPG4 IL2RA NFKBIA NDST4 PITPNM3 SIRT2 MXI1 ZFP827 CTSD MBP AFF1 NR4A2 APOE HSBP1 NFIA SOX5 C3 CALB2 CSRNP3 B2M DEPTOR KLF12 CDKN1A SULF1 VIM PCDHB16 DIO2 DPYSL3 EXPH5 CGNL1 CDKN2A HIVEP3 PTPRO FSTL5 IL15RA HTR4 CD38 TTYH2 SERPINA3N TSHZ2 SOX6 CTSB PDCD1 NPR3 SATB2 PTGES2 TRABD2B SIRT7 AFF3 PDE10A TGFB3 THRB ANO2 CHRM3 C4B CALB1 HMGCR E2F3 PDE8A ZBTB20 IL13 IL12A GFAP IGF2 IFIT3 GRIN2C FOXP2 HEXB GATA3 FOXP3 IL17F CD19 CD3E EGFR DRD1 CTSS NKAIN3 CPA6 CD14 ZFHX3 EPHB1 HIPK2 CHRNA2 LYZ2 OLIG2 CLEC10A HIF3A TRPS1 CNTNAP5B NLRP3 TH NXPH2 SCUBE1 TCF7L1 ZFP804A BANP FMO2 CREB3L2 RSPO1 RORC PRDM1 LCORL KLRG1 KCNIP2 ITPR2 MS4A1 MRC1 LSP1 LHX6 IRF3 ADAM12 IL23A ITGAE IL22 NEAT1 CD209G CLDN34C1 BBX SDK1 ZFP385B 9530026P05RIK NFKB1 NXPH4 PVALB UACA CASR TRIM30A SMOC2 SNCG TREM2 SFMBT2 ARID5B TAP1 SLC24A3 PARP4 VWC2L CRH CPNE9 CRISPLD1 GPC5 BGN CD9 RSPO3 S100A10 CRISPLD2 CSF1R CRHBP JDP2 EIF5B TEAD2 CD300C2 AGBL1 ABI3 ACTA2 ADORA2A AIF1 ANLN APLN ARHGAP6 KCTD8 JAZF1 MEI1 BMP4 CD74 ATP10B CREB5 PAPPA DGKA ADRA1A CR2 CRHR2 ASTN2 ZC3HAV1 MITF ADARB2 NAMPT RORA FBN2 FRMD4B B230323A14RIK TTR VIP VIPR2 VTN 5033421B08RIK GREB1 LRRC9 SPTB ADGRG6 GLIS3 COL4A3 PLEKHG1 ONECUT2 A530053G22RIK TIPARP EBF1 SELPLG SERPINF1 SLC17A6 SLC17A8 SLC32A1 SLC6A20A SPI1 SST SYT6 TBX21 TCAP TGFB1 TGFB2 TMEM132C TNF NLRP1B OPALIN OSR1 OTOF PARP14 PLEKHG3 PROX1 PTPRC PTPRU RORB RSKR RXFP1 IGF1 HS3ST3A1 TOX2 PRR5L MAF NFE2L2 GRIN3A NPAS3 IGF2BP3 MAN1A AXL NR6A1 HS3ST4 IL2RB IL2RG IL33 IL4 IL5 IL6 IL7R IRF7 ITGAM ITGAX ITGB2 KCNJ8 KLRB1 KLRK1 LAMA1 LMO1 MFGE8 MYH11 FBLN2 MAML3 C130026I21RIK XDH TNC COL11A1 FOXJ1 GAD1 GAD2 GBP10 GBP6 GDPD4 GSDMD H2-AB1 HPSE IFI44 IFITM3 IFNA12 IFNA16 IFNA2 IFNG IL10 IL17A IL1B MEIS1 SCG2 9330185C12RIK CX3CR1 CXCL10 CXCL9 CYP27A1 DRD2 EMID1 ENPP6 EOMES F13A1 FCGR1 FEZF2 FN1 PDE3A LILRB4A 3222401L13RIK SIRT3 CCL2 CCN2 CCR2 CD1D1 AQP4 CDKN2B CHAT CHODL DACH1 SP100 CTLA4 TNFSF8 PRDM16 CAR3 PBX3 C1QL1 C1QC C1QA
